,name,year,month,uri,bio,rank,listUri,finalWorth,otherCompensation,countryRank,person,visible,personName,age,country,state,city,source,industries,countryOfCitizenship,timestamp,version,moneyRank,tvRadioRank,pressRank,webRank,socialRank,naturalId,position,imageExists,change,changePercent,selfMade,status,gender,birthDate,countryId,lastName,firstName,listDescription,shortUri,galleryShortUri,listShortUri,date,wealthList,familyList,thumbnail,squareImage,bioSuppress,factivaHits,webHits,tvRadio,recentEarnings,recentSales,recentBudget,gdp,budget,assets,totalCompensation,salary,bonus,stockOptions,population,audienceWeb,audiencePrint,audienceTv,employees,following,category,previousRank,csfDisplayFields,suppressOnProfiles,organization,title,employment,portraitImage,landscapeImage
247,Billionaires,2003,3,wee-cho-yaw,"Aggressive dealmaker who succeeded his father to head Singapore&#8217;s United Overseas Bank in 1974. Proceeded to transform the bank, which was founded in 1935 by his father and six other Chinese businessmen, through a series of mergers and takeovers. Under his watch, United Overseas Bank has become the largest bank in Singapore, with more than $60 billion in assets. An ambitious and talented banker, Wee wants to turn UOB into a &#8220;regional financial powerhouse.&#8221;",329,billionaires,1300.0,,,"{'name': 'Cho Yaw Wee & family', 'uri': 'wee-cho-yaw', 'imageExists': True, 'squareImage': '//specials-images.forbesimg.com/imageserve/5a80f50531358e4955ad2ec8/416x416.jpg?background=000000&cropX1=628&cropX2=3834&cropY1=0&cropY2=3207'}",True,Cho Yaw Wee & family,74.0,Singapore,,Singapore,,['Finance'],Singapore,1309541495203,1309541520767,,,,,0,faris/5/2003/4490,345,True,,,,,,,,,,,http://onforb.es/1IR6Yer,http://onforb.es/1fjZfxm,http://onforb.es/1IR71XC,1046494800000,False,False,http://specials-images.forbesimg.com/imageserve/5a80f50531358e4955ad2ec8/280x425.jpg?fit=scale&background=000000,//specials-images.forbesimg.com/imageserve/5a80f50531358e4955ad2ec8/416x416.jpg?background=000000&cropX1=628&cropX2=3834&cropY1=0&cropY2=3207,False,0.0,0.0,0.0,0.0,0.0,0.0,0.0,0.0,0.0,0.0,0.0,0.0,0.0,0.0,0.0,0.0,0.0,0.0,0.0,,,,,,,,,
248,Billionaires,2003,3,lee-bass,"Bass family took flak last year for selling Disney shares to meet margin call. With stock dipping below $15, Lee and his brothers Sid and Edward save a little face. Still smarting after late-1990s bets in technology (Globalstar), biotech (Human Genome Sciences), but stake in Hawthorn Financial returned 1,300% in past year. Father, Perry, built investment empire on oil fortune inherited from uncle Sid Richardson (d. 1951). Handed business to eldest son, Sid, in 1968, prompting brother Robert (see) to break out on his own. Other brothers parted ways with longtime money manager Tommy Taylor in 1999, after ill-timed Canadian investments. Bass family still holds large Disney stake; major force in reviving downtown Fort Worth.",348,billionaires,1200.0,,,"{'name': 'Lee Bass', 'uri': 'lee-bass', 'squareImage': '//specials-images.forbesimg.com/imageserve/db064336a2edd9c66daa21ddc22a8695/416x416.jpg?background=000000&cropX1=0&cropX2=744&cropY1=18&cropY2=762'}",True,Lee Bass,46.0,United States,Texas,Fort Worth,,['Oil'],United States,1309540052791,1309540082135,,,,,0,faris/5/2003/5133,347,,,,,,,,,,,,http://onforb.es/1IR6Yer,http://onforb.es/1BOUMga,http://onforb.es/1IR71XC,1046494800000,False,False,http://specials-images.forbesimg.com/imageserve/db064336a2edd9c66daa21ddc22a8695/280x425.jpg?fit=scale&background=000000,//specials-images.forbesimg.com/imageserve/db064336a2edd9c66daa21ddc22a8695/416x416.jpg?background=000000&cropX1=0&cropX2=744&cropY1=18&cropY2=762,False,0.0,0.0,0.0,0.0,0.0,0.0,0.0,0.0,0.0,0.0,0.0,0.0,0.0,0.0,0.0,0.0,0.0,0.0,0.0,,,,,,,,,
249,Billionaires,2003,3,julio-bozano,"Since he sold his Banco Bozano, Simonsen to Spain&#8217;s Banco Santander Central Hispano in 2000, Bozano has dropped out of the business headlines in Brazil. Talk is that he married his race horses&#8217; veterinarian, sired a daughter with her and lives in Greenwich, Connecticut, though he keeps a pied-&#224;-terre in Rio.",348,billionaires,1200.0,,,"{'name': 'Julio Bozano', 'uri': 'julio-bozano', 'squareImage': '//specials-images.forbesimg.com/imageserve/7c49586f49000892959270e53710d139/416x416.jpg?background=000000&cropX1=3&cropX2=744&cropY1=44&cropY2=785'}",True,Julio Bozano,67.0,Brazil,,Rio de Janeiro,,['Finance'],Brazil,1309541857828,1309541873718,,,,,0,faris/5/2003/4896,348,,,,,,,,,,,,http://onforb.es/1IR6Yer,http://onforb.es/1zwx8O2,http://onforb.es/1IR71XC,1046494800000,False,False,http://specials-images.forbesimg.com/imageserve/7c49586f49000892959270e53710d139/280x425.jpg?fit=scale&background=000000,//specials-images.forbesimg.com/imageserve/7c49586f49000892959270e53710d139/416x416.jpg?background=000000&cropX1=3&cropX2=744&cropY1=44&cropY2=785,False,0.0,0.0,0.0,0.0,0.0,0.0,0.0,0.0,0.0,0.0,0.0,0.0,0.0,0.0,0.0,0.0,0.0,0.0,0.0,,,,,,,,,
250,Billionaires,2003,3,ennio-doris,"Chief executive of Mediolanum SpA, a life insurance and fund management company he cofounded. Mediolanum is part of  Prime Minister Silvio Berlusconi&#8217;s business empire. Doris is entertaining the possibility of buying out Berlusconi&#8217;s stake. In his spare time, he enjoys mountain biking.",348,billionaires,1200.0,,,"{'name': 'Ennio Doris & family', 'uri': 'ennio-doris', 'squareImage': '//specials-images.forbesimg.com/imageserve/5e76d3b210380d0006fbb825/416x416.jpg?background=000000&cropX1=576&cropX2=1639&cropY1=0&cropY2=1063'}",True,Ennio Doris & family,62.0,Italy,,Tombolo,,['Insurance'],Italy,1309541858503,1309541878569,,,,,0,faris/5/2003/4493,350,,,,,,,,,,,,http://onforb.es/1IR6Yer,http://onforb.es/1BOUvKm,http://onforb.es/1IR71XC,1046494800000,False,False,http://specials-images.forbesimg.com/imageserve/5e76d3b210380d0006fbb825/280x425.jpg?fit=scale&background=000000,//specials-images.forbesimg.com/imageserve/5e76d3b210380d0006fbb825/416x416.jpg?background=000000&cropX1=576&cropX2=1639&cropY1=0&cropY2=1063,False,0.0,0.0,0.0,0.0,0.0,0.0,0.0,0.0,0.0,0.0,0.0,0.0,0.0,0.0,0.0,0.0,0.0,0.0,0.0,,,,,,,,,
251,Billionaires,2003,3,bennett-dorrance,"Grandson of Campbell Soup founder John T. Dorrance; left half of fortune to son, John Jr., remainder to 3 daughters. John Jr. died 1989, children inherited his stake (eldest son, John III, became Irish citizen to avoid U.S. taxes). Family members still control half of Campbell Soup Co. stock. Bennett Dorrance avid gardener, recently pledged $5 million to Pennsylvania Academy of Fine Arts.",348,billionaires,1200.0,0.0,151.0,"{'name': 'Bennett Dorrance', 'uri': 'bennett-dorrance', 'imageExists': True, 'squareImage': '//specials-images.forbesimg.com/imageserve/2a96ddbe76c1eeed78fcd008987e09e8/416x416.jpg?background=000000&cropX1=58&cropX2=689&cropY1=132&cropY2=764'}",True,Bennett Dorrance,56.0,United States,Arizona,Paradise Valley,,['Food and Beverage'],United States,1337117081437,1337117124647,0.0,0.0,0.0,0.0,0,faris/5/2003/5312,351,True,-300.0,-20.0,False,D,M,-753994800000.0,225.0,Dorrance,Bennett,The World's Billionaires,http://onforb.es/1IR6Yer,http://onforb.es/1zwv9cH,http://onforb.es/1IR71XC,1046494800000,False,False,http://specials-images.forbesimg.com/imageserve/2a96ddbe76c1eeed78fcd008987e09e8/280x425.jpg?fit=scale&background=000000,//specials-images.forbesimg.com/imageserve/2a96ddbe76c1eeed78fcd008987e09e8/416x416.jpg?background=000000&cropX1=58&cropX2=689&cropY1=132&cropY2=764,False,,,,,,,,,,,,,,,,,,,,,,,,,,,,
252,Billionaires,2003,3,philippe-foriel-destezet,"Tumbling stocks hit Foriel-Destezet&#8217;s fortune hard last year, with his principal holdings falling in value by more than a third. London-based to escape French wealth taxes, Foriel-Destezet has reconfigured his investment portfolio to avoid French companies. The bulk of his wealth is derived from his 18% stake in Adecco, the temporary-services company he cofounded with Swiss billionaire Klaus Jacobs. He also has investments in ISS, a Danish office cleaning firm, and Securitas, a Swedish security company. Last spring Foriel-Destezet resigned from the board of Vivendi Universal, one of a string of board resignations that undermined support for then-chief executive Jean-Marie Messier.",348,billionaires,1200.0,,,"{'name': 'Philippe Foriel-Destezet', 'uri': 'philippe-foriel-destezet', 'squareImage': 'https://specials-images.forbesimg.com/imageserve/6050f48ca1ab099ed6e290cc/416x416.jpg?background=000000&cropX1=0&cropX2=800&cropY1=0&cropY2=800'}",True,Philippe Foriel-Destezet,67.0,United Kingdom,,London,,,France,1309542267379,1309542285728,,,,,0,faris/5/2003/4577,355,,,,,,,,,,,,http://onforb.es/1IR6Yer,http://onforb.es/1zwv1K5,http://onforb.es/1IR71XC,1046494800000,False,False,http://specials-images.forbesimg.com/imageserve/6050f48ca1ab099ed6e290cc/280x425.jpg?fit=scale&background=000000,https://specials-images.forbesimg.com/imageserve/6050f48ca1ab099ed6e290cc/416x416.jpg?background=000000&cropX1=0&cropX2=800&cropY1=0&cropY2=800,False,0.0,0.0,0.0,0.0,0.0,0.0,0.0,0.0,0.0,0.0,0.0,0.0,0.0,0.0,0.0,0.0,0.0,0.0,0.0,,,,,,,,,
253,Billionaires,2003,3,barbara-carlson-gage,"Daughter of tireless salesman Curtis Carlson (d. 1999), who invested $50 to start Gold Bond Trading Stamps in 1938, built into marketing, travel, hospitality conglomerate that includes Radisson Hotels, T.G.I. Friday's. Sister Marilyn placed in charge of company in 1998. Sizable Carlson Companies travel segment struggling along with rest of industry after September terrorist attacks.",348,billionaires,1200.0,,,"{'name': 'Barbara Carlson Gage & family', 'uri': 'barbara-carlson-gage'}",True,Barbara Carlson Gage & family,61.0,United States,Minnesota,Minneapolis,,,United States,1309542459161,1309542493661,,,,,0,faris/5/2003/6069,356,,,,,,,,,,,,http://onforb.es/1IR6Yer,http://onforb.es/1BOVslU,http://onforb.es/1IR71XC,1046494800000,False,False,,,False,0.0,0.0,0.0,0.0,0.0,0.0,0.0,0.0,0.0,0.0,0.0,0.0,0.0,0.0,0.0,0.0,0.0,0.0,0.0,,,,,,,,,
254,Billionaires,2003,3,tom-golisano,"Started payroll outsourcing business with $3,000 in 1971. Took Paychex public 1983. Now processes paychecks for more than 350,000 customers. Spent $20 million on failed bids for New York's governor's office in 1994, 1998. Reportedly spent $75 million this year on a third campaign.",348,billionaires,1200.0,,,"{'name': 'B. Thomas Golisano', 'uri': 'tom-golisano', 'squareImage': 'https://specials-images.forbesimg.com/imageserve/5f4972a5099f88892f707f4e/416x416.jpg?background=000000&cropX1=748&cropX2=2711&cropY1=259&cropY2=2220'}",True,B. Thomas Golisano,61.0,United States,New York,Rochester,,,United States,1309541741682,1309541776344,,,,,0,faris/5/2003/6473,357,,,,,,,,,,,,http://onforb.es/1IR6Yer,http://onforb.es/1zwuZlz,http://onforb.es/1IR71XC,1046494800000,False,False,http://specials-images.forbesimg.com/imageserve/5f4972a5099f88892f707f4e/280x425.jpg?fit=scale&background=000000,https://specials-images.forbesimg.com/imageserve/5f4972a5099f88892f707f4e/416x416.jpg?background=000000&cropX1=748&cropX2=2711&cropY1=259&cropY2=2220,False,0.0,0.0,0.0,0.0,0.0,0.0,0.0,0.0,0.0,0.0,0.0,0.0,0.0,0.0,0.0,0.0,0.0,0.0,0.0,,,,,,,,,
255,Billionaires,2003,3,joe-jamail-jr,"Personal injury lawyer made fortune in  Texaco-Pennzoil case 1987; received estimated $345 million in fees. Now defending one of Enron's law firms, Vinson &#38; Elkins: ""I don't need the money, but I'll take it.""",348,billionaires,1200.0,,,"{'name': 'Joseph Jamail', 'uri': 'joe-jamail-jr'}",True,Joseph Jamail,77.0,United States,Texas,Houston,,,United States,1309540720098,1309540757659,,,,,0,faris/5/2003/5844,359,,,,,,,,,,,,http://onforb.es/1IR6Yer,http://onforb.es/1BOUI06,http://onforb.es/1IR71XC,1046494800000,False,False,,,False,0.0,0.0,0.0,0.0,0.0,0.0,0.0,0.0,0.0,0.0,0.0,0.0,0.0,0.0,0.0,0.0,0.0,0.0,0.0,,,,,,,,,
256,Billionaires,2003,3,rupert-johnson-jr,"Runs mutual fund giant Franklin Resources with half-brother Charles Johnson (see). Rupert, Washington and Lee grad and ex-Marine, is vice chairman. After last year's purchase of Fiduciary Trust, firm now manages $271 billion in assets.",348,billionaires,1200.0,,,"{'name': 'Rupert Johnson', 'uri': 'rupert-johnson-jr', 'squareImage': '//specials-images.forbesimg.com/imageserve/57e0693fa7ea430a8a1a0744/416x416.jpg?background=000000&cropX1=0&cropX2=692&cropY1=55&cropY2=748'}",True,Rupert Johnson,62.0,United States,California,San Mateo,,['Finance'],United States,1309539809473,1309539860242,,,,,0,faris/5/2003/5327,361,,,,,,,,,,,,http://onforb.es/1IR6Yer,http://onforb.es/1BOTQsh,http://onforb.es/1IR71XC,1046494800000,False,False,http://specials-images.forbesimg.com/imageserve/57e0693fa7ea430a8a1a0744/280x425.jpg?fit=scale&background=000000,//specials-images.forbesimg.com/imageserve/57e0693fa7ea430a8a1a0744/416x416.jpg?background=000000&cropX1=0&cropX2=692&cropY1=55&cropY2=748,False,0.0,0.0,0.0,0.0,0.0,0.0,0.0,0.0,0.0,0.0,0.0,0.0,0.0,0.0,0.0,0.0,0.0,0.0,0.0,,,,,,,,,
257,Billionaires,2003,3,richard-kinder,"Former Enron president wisely left firm in 1996, uncomfortable with ""asset light"" strategy. Bought Enron's asset-rich liquid-gas pipeline operations with college classmate William Morgan. Today Kinder Morgan controls over 30,000 miles of pipe, transports 2 million barrels a day. Also owns bulk terminals, power plants. Vietnam vet careful to avoid Enron excesses: flies coach class, pays himself just $1 a year.",348,billionaires,1200.0,,,"{'name': 'Richard Kinder', 'uri': 'richard-kinder', 'squareImage': '//specials-images.forbesimg.com/imageserve/5c76d0e4a7ea43100043cdf2/416x416.jpg?background=000000&cropX1=995&cropX2=3185&cropY1=56&cropY2=2245'}",True,Richard Kinder,58.0,United States,Texas,Houston,,['Oil'],United States,1309539772791,1309539795878,,,,,0,faris/5/2003/7086,362,,,,,,,,,,,,http://onforb.es/1IR6Yer,http://onforb.es/1zwsOOU,http://onforb.es/1IR71XC,1046494800000,False,False,http://specials-images.forbesimg.com/imageserve/5c76d0e4a7ea43100043cdf2/280x425.jpg?fit=scale&background=000000,//specials-images.forbesimg.com/imageserve/5c76d0e4a7ea43100043cdf2/416x416.jpg?background=000000&cropX1=995&cropX2=3185&cropY1=56&cropY2=2245,False,0.0,0.0,0.0,0.0,0.0,0.0,0.0,0.0,0.0,0.0,0.0,0.0,0.0,0.0,0.0,0.0,0.0,0.0,0.0,,,,,,,,,
258,Billionaires,2003,3,george-lindemann,"Wharton grad sold patent on soft contact lens for $60 million in 1971. Started Vision Cable, sold for $220 million 1982. Later formed Metro Mobile cell service, sold to Bell Atlantic for $2.6 billion in 1992. Current chief of natural gas company Southern Union also owns 19 Spanish-language radio stations. Tools around on Adela, his 185-foot, two-masted schooner.",348,billionaires,1200.0,0.0,151.0,"{'name': 'George Lindemann & family', 'uri': 'george-lindemann', 'imageExists': True, 'squareImage': 'http://specials-images.forbesimg.com/imageserve/67c70c6aef6863d196e8a34b8300eeaa/416x416.jpg?background=000000&cropX1=69&cropX2=705&cropY1=39&cropY2=676'}",True,George Lindemann & family,66.0,United States,Florida,Palm Beach,,['Investments'],United States,1337117144203,1337117205353,0.0,0.0,0.0,0.0,0,faris/5/2003/5592,364,True,0.0,0.0,False,E,M,-1065639600000.0,225.0,Lindemann,George,The World's Billionaires,http://onforb.es/1IR6Yer,http://onforb.es/1zwu6tb,http://onforb.es/1IR71XC,1046494800000,False,False,http://specials-images.forbesimg.com/imageserve/67c70c6aef6863d196e8a34b8300eeaa/280x425.jpg?fit=scale&background=000000,http://specials-images.forbesimg.com/imageserve/67c70c6aef6863d196e8a34b8300eeaa/416x416.jpg?background=000000&cropX1=69&cropX2=705&cropY1=39&cropY2=676,False,,,,,,,,,,,,,,,,,,,,,,,,,,,,
259,Billionaires,2003,3,alexey-mordashov,"Boss of Severstal, Russia&#8217;s largest steel company. Son of millworker parents, in the mid-1980s Mordashov left to study economics in Leningrad, then returned and was named finance director of the local steel mill. When the plant&#8217;s elderly general director instructed him to buy up the shares of the company so it would not fall into the hands of an outsider, Mordashov bought most of the shares himself. Became general director of the company and built it into a conglomerate, acquiring automaker UAZ, coal companies, railroad companies, port facilities, local TV stations and newspapers. Having been targeted by President Bush&#8217;s imposition of steel tariffs in last year, Mordashov is a leading proponent of Russia&#8217;s entry into the WTO.",348,billionaires,1200.0,0.0,10.0,"{'name': 'Alexey Mordashov', 'uri': 'alexey-mordashov', 'imageExists': True, 'squareImage': '//specials-images.forbesimg.com/imageserve/5e87b07fbf94c200067fcf57/416x416.jpg?background=000000&cropX1=1002&cropX2=4157&cropY1=163&cropY2=3318'}",True,Alexey Mordashov,37.0,Russia,,Moscow,,['Metals & Mining'],Russia,1338913992453,1338914053586,0.0,0.0,0.0,0.0,0,faris/5/2003/7385,366,True,,,False,N,M,-134596800000.0,195.0,Mordashov,Alexey,The World's Billionaires,http://onforb.es/1IR6Yer,http://onforb.es/1zwstMa,http://onforb.es/1IR71XC,1046494800000,False,False,http://specials-images.forbesimg.com/imageserve/5e87b07fbf94c200067fcf57/280x425.jpg?fit=scale&background=000000,//specials-images.forbesimg.com/imageserve/5e87b07fbf94c200067fcf57/416x416.jpg?background=000000&cropX1=1002&cropX2=4157&cropY1=163&cropY2=3318,False,,,,,,,,,,,,,,,,,,,,,,,,,,,,
260,Billionaires,2003,3,charles-munger,"Low-profile partner of Warren Buffett serves as vice chairman of Berkshire Hathaway. Met Buffett 1959, started investing in Berkshire soon after. Runs Berkshire's Wesco Financial subsidiary out of Los Angeles; also guides legal publisher Daily Journal Corp., sits on board of big-box retailer Costco. Harvard-trained lawyer avid fisherman, supporter of arts in southern California: donated 100 Berkshire shares to help build new wing at Pasadena's Huntington Library.",348,billionaires,1200.0,,,"{'name': 'Charles Munger', 'uri': 'charles-munger', 'squareImage': '//specials-images.forbesimg.com/imageserve/88da1feb2b57450c4b7fe5a4423a1f8d/416x416.jpg?background=000000&cropX1=53&cropX2=721&cropY1=16&cropY2=685'}",True,Charles Munger,78.0,United States,California,Los Angeles,,['Finance'],United States,1309541319537,1309541355323,,,,,0,faris/5/2003/5385,367,,,,,,,,,,,,http://onforb.es/1IR6Yer,http://onforb.es/1BOV7iR,http://onforb.es/1IR71XC,1046494800000,False,False,http://specials-images.forbesimg.com/imageserve/88da1feb2b57450c4b7fe5a4423a1f8d/280x425.jpg?fit=scale&background=000000,//specials-images.forbesimg.com/imageserve/88da1feb2b57450c4b7fe5a4423a1f8d/416x416.jpg?background=000000&cropX1=53&cropX2=721&cropY1=16&cropY2=685,False,0.0,0.0,0.0,0.0,0.0,0.0,0.0,0.0,0.0,0.0,0.0,0.0,0.0,0.0,0.0,0.0,0.0,0.0,0.0,,,,,,,,,
261,Billionaires,2003,3,marilyn-carlson-nelson,"Daughter of tireless salesman Curtis Carlson (d. 1999) who invested $50 to start Gold Bond Trading Stamps in 1938, built into marketing, travel, hospitality conglomerate that includes Radisson Hotels, T.G.I. Friday's. Marilyn placed in charge of company in 1998, sister Barbara Carlson Gage retains significant stake in firm. Sizable Carlson Companies travel segment struggling along with rest of industry after September terrorist attacks.",348,billionaires,1200.0,,,"{'name': 'Marilyn Carlson Nelson & family', 'uri': 'marilyn-carlson-nelson'}",True,Marilyn Carlson Nelson & family,64.0,United States,Minnesota,Minneapolis,,,United States,1309539664426,1309539680323,,,,,0,faris/5/2003/6879,369,,,,,,,,,,,,http://onforb.es/1IR6Yer,http://onforb.es/1zwxVyL,http://onforb.es/1IR71XC,1046494800000,False,False,http://specials-images.forbesimg.com/imageserve/56d1c8c5e4b0c144a7f6662b/280x425.jpg?fit=scale&background=000000,,False,0.0,0.0,0.0,0.0,0.0,0.0,0.0,0.0,0.0,0.0,0.0,0.0,0.0,0.0,0.0,0.0,0.0,0.0,0.0,,,,,,,,,
262,Billionaires,2003,3,emanuele-lino-saputo,"The cheese whiz. Chairman and CEO of Quebec-based Saputo Inc., Canada&#8217;s largest dairy processor, joins the billionaires club this year. Fiscal year March 2002 profits rose 29% to $106 million, while sales hit $2.3 billion, up 60% from 2001. Company close to reaching a sponsorship deal with Rocketsports Racing. The son of a cheesemaker, Saputo helped his Italian family start a mom-and-pop dairy company shortly after moving to Canada in 1952. Became big cheese himself, chairman of the board and president since 1969.",348,billionaires,1200.0,,,"{'name': 'Emanuele (Lino) Saputo', 'uri': 'emanuele-lino-saputo', 'squareImage': '//specials-images.forbesimg.com/imageserve/5e74437e2a573300068fcd76/416x416.jpg?background=000000&cropX1=0&cropX2=1092&cropY1=284&cropY2=1376'}",True,Emanuele (Lino) Saputo,66.0,Canada,,Quebec,,['Food'],Canada,1309542553353,1309542567177,,,,,0,faris/5/2003/7233,371,,,,,,,,,,,,http://onforb.es/1IR6Yer,http://onforb.es/1zwttjs,http://onforb.es/1IR71XC,1046494800000,False,False,http://specials-images.forbesimg.com/imageserve/5e74437e2a573300068fcd76/280x425.jpg?fit=scale&background=000000,//specials-images.forbesimg.com/imageserve/5e74437e2a573300068fcd76/416x416.jpg?background=000000&cropX1=0&cropX2=1092&cropY1=284&cropY2=1376,False,0.0,0.0,0.0,0.0,0.0,0.0,0.0,0.0,0.0,0.0,0.0,0.0,0.0,0.0,0.0,0.0,0.0,0.0,0.0,,,,,,,,,
263,Billionaires,2003,3,bruno-schroder,"Along with sister Charmaine, owns almost half of his family&#8217;s financial services company, Schroders Plc. Watched his net worth tumble $1 billion thanks to Schroders&#8217; ailing stock price, off 45% since last year. Nonetheless the company presses on with expansion into alternative investments. In October 2001, Schroder paid $48 million for London-based Beaumont Capital Management, a hedge fund with $275 million under management. Schroder is known as an amiable man who loves flying airplanes, hunting stags and relaxing at his Scottish estate.",348,billionaires,1200.0,,,"{'name': 'Bruno Schroder & family', 'uri': 'bruno-schroder', 'squareImage': '//specials-images.forbesimg.com/imageserve/5a70f09e4bbe6f2652f40d95/416x416.jpg?background=000000&cropX1=65&cropX2=241&cropY1=0&cropY2=176'}",True,Bruno Schroder & family,70.0,United Kingdom,,London,,['Finance'],United Kingdom,1309540568069,1309540591112,,,,,0,faris/5/2003/4574,372,,,,,,,,,,,,http://onforb.es/1IR6Yer,http://onforb.es/1BOTEJE,http://onforb.es/1IR71XC,1046494800000,False,False,http://specials-images.forbesimg.com/imageserve/5a70f09e4bbe6f2652f40d95/280x425.jpg?fit=scale&background=000000,//specials-images.forbesimg.com/imageserve/5a70f09e4bbe6f2652f40d95/416x416.jpg?background=000000&cropX1=65&cropX2=241&cropY1=0&cropY2=176,False,0.0,0.0,0.0,0.0,0.0,0.0,0.0,0.0,0.0,0.0,0.0,0.0,0.0,0.0,0.0,0.0,0.0,0.0,0.0,,,,,,,,,
264,Billionaires,2003,3,thomas-siebel,"Gained fame and fortune in 1980s as top salesman for Oracle. Developed internal sales automation software; left 1990 after Oracle Chief Larry Ellison (see) scrapped his plans to bring it to market. Launched Siebel Systems 1993; IPO 1996. Sales doubled 5 of 6 years, but hit wall in 2001: software licensing revenues off 33% in the first 6 months of last year, shares down 77% from their year high in January. Politically active, hopes to juice sales in public sector. New $2.1 million PAC, largest in tech industry, should help.",348,billionaires,1200.0,,,"{'name': 'Thomas Siebel', 'uri': 'thomas-siebel', 'squareImage': '//specials-images.forbesimg.com/imageserve/5d8afefa18444200084e73b7/416x416.jpg?background=000000&cropX1=691&cropX2=3487&cropY1=370&cropY2=3168'}",True,Thomas Siebel,50.0,United States,California,San Mateo,,,United States,1309539665901,1309539683233,,,,,0,faris/5/2003/6737,373,,,,,,,,,,,,http://onforb.es/1IR6Yer,http://onforb.es/1BOUrdp,http://onforb.es/1IR71XC,1046494800000,False,False,http://specials-images.forbesimg.com/imageserve/5d8afefa18444200084e73b7/280x425.jpg?fit=scale&background=000000,//specials-images.forbesimg.com/imageserve/5d8afefa18444200084e73b7/416x416.jpg?background=000000&cropX1=691&cropX2=3487&cropY1=370&cropY2=3168,False,0.0,0.0,0.0,0.0,0.0,0.0,0.0,0.0,0.0,0.0,0.0,0.0,0.0,0.0,0.0,0.0,0.0,0.0,0.0,,,,,,,,,
265,Billionaires,2003,3,john-a-sobrato,"Palo Alto residential broker in 1960s branched into commercial projects in Silicon Valley. Today owns 11 million square feet, 470 acres, 5,800 apartment units. With son, John Michael, launched $10 million Sobrato Affordable Housing Fund. Sold 400,000-square-foot office space to VeriSign last October for $283 million, spent proceeds on apartment units throughout western states.",348,billionaires,1200.0,,,"{'name': 'John Sobrato & family', 'uri': 'john-a-sobrato', 'squareImage': '//specials-images.forbesimg.com/imageserve/47d41e6a7ea49d31cbada544a1ce4e5b/416x416.jpg?background=000000&cropX1=3&cropX2=744&cropY1=134&cropY2=875'}",True,John Sobrato & family,63.0,United States,California,Atherton,,['Real Estate'],United States,1309540413023,1309540451232,,,,,0,faris/5/2003/6706,374,,,,,,,,,,,,http://onforb.es/1IR6Yer,http://onforb.es/1zwtKmk,http://onforb.es/1IR71XC,1046494800000,False,False,http://specials-images.forbesimg.com/imageserve/47d41e6a7ea49d31cbada544a1ce4e5b/280x425.jpg?fit=scale&background=000000,//specials-images.forbesimg.com/imageserve/47d41e6a7ea49d31cbada544a1ce4e5b/416x416.jpg?background=000000&cropX1=3&cropX2=744&cropY1=134&cropY2=875,False,0.0,0.0,0.0,0.0,0.0,0.0,0.0,0.0,0.0,0.0,0.0,0.0,0.0,0.0,0.0,0.0,0.0,0.0,0.0,,,,,,,,,
