,name,year,month,uri,bio,rank,listUri,finalWorth,otherCompensation,countryRank,person,visible,personName,age,country,state,city,source,industries,countryOfCitizenship,timestamp,version,moneyRank,tvRadioRank,pressRank,webRank,socialRank,naturalId,position,imageExists,change,changePercent,selfMade,status,gender,birthDate,countryId,lastName,firstName,listDescription,shortUri,galleryShortUri,listShortUri,date,wealthList,familyList,thumbnail,squareImage,bioSuppress,factivaHits,webHits,tvRadio,recentEarnings,recentSales,recentBudget,gdp,budget,assets,totalCompensation,salary,bonus,stockOptions,population,audienceWeb,audiencePrint,audienceTv,employees,following,previousRank,csfDisplayFields,suppressOnProfiles,category,title,organization,employment,portraitImage,landscapeImage
397,Billionaires,2005,3,alicia-koplowitz,"In the 1960s she and older sister Esther inherited construction giant Fomentos de Construcciones y Contratas, the company their father founded in 1944. In 1997 sold her shares to Esther for $800 million. Since then has been carefully investing in companies like Acerinox, Enagos, Banco Sabadel, Endesa, Inditex; also owns U.S. real estate and has stakes in hotels in Spain, Italy and Portugal. A member of Spanish nobility (she holds the title of Marquesa de Bellavista), she has long been considered one of Spain&#8217;s most eligible women. But now rumor has it she is romantically linked to the Duque of H&#250;escar, heir to the famous Spanish house of Alba.",488,billionaires,1400.0,,,"{'name': 'Alicia Koplowitz', 'uri': 'alicia-koplowitz', 'squareImage': '//specials-images.forbesimg.com/imageserve/5e77bc1bd8e1ae0007b734bb/416x416.jpg?background=000000&cropX1=263&cropX2=2309&cropY1=51&cropY2=2097'}",True,Alicia Koplowitz,52.0,Spain,,Madrid,,['Investments'],Spain,1309542310735,1309542340839,,,,,0,faris/5/2005/4669,494,,,,,,,,,,,,http://onforb.es/1IR6Yer,http://onforb.es/1zwv9cL,http://onforb.es/1IR71XC,1109653200000,False,False,http://specials-images.forbesimg.com/imageserve/5e77bc1bd8e1ae0007b734bb/280x425.jpg?fit=scale&background=000000,//specials-images.forbesimg.com/imageserve/5e77bc1bd8e1ae0007b734bb/416x416.jpg?background=000000&cropX1=263&cropX2=2309&cropY1=51&cropY2=2097,False,0.0,0.0,0.0,0.0,0.0,0.0,0.0,0.0,0.0,0.0,0.0,0.0,0.0,0.0,0.0,0.0,0.0,0.0,0.0,,,,,,,,,
398,Billionaires,2005,3,nancy-lerner,"Daughter of Al Lerner (d. 2002), Brooklyn-born immigrant&#8217;s son who built credit card giant MBNA, brought NFL back to Cleveland. Family still holds major stake in MBNA, though much reduced by taxman. Brother, Randy, chairman of MBNA, took over football&#8217;s Cleveland Browns after father&#8217;s death from cancer; mother Norma served briefly on MBNA board. Nancy, a former prosecuting attorney, now active in family&#8217;s real estate investments. Family keeps low profile, but active in educational, medical philanthropy in Cleveland area.",488,billionaires,1400.0,0.0,221.0,"{'name': 'Nancy Lerner', 'uri': 'nancy-lerner', 'squareImage': 'https://specials-images.forbesimg.com/imageserve/6050f48ca1ab099ed6e290cc/416x416.jpg?background=000000&cropX1=0&cropX2=800&cropY1=0&cropY2=800'}",True,Nancy Lerner,44.0,United States,Ohio,Cleveland,,['Finance'],United States,1337117344453,1337117386653,0.0,0.0,0.0,0.0,0,faris/5/2005/7433,495,,-200.0,-12.5,False,D,F,-306097200000.0,225.0,Lerner,Nancy,The World's Billionaires,http://onforb.es/1IR6Yer,http://onforb.es/1KpG0f3,http://onforb.es/1IR71XC,1109653200000,False,False,http://specials-images.forbesimg.com/imageserve/6050f48ca1ab099ed6e290cc/280x425.jpg?fit=scale&background=000000,https://specials-images.forbesimg.com/imageserve/6050f48ca1ab099ed6e290cc/416x416.jpg?background=000000&cropX1=0&cropX2=800&cropY1=0&cropY2=800,False,,,,,,,,,,,,,,,,,,,,,,,,,,,,
399,Billionaires,2005,3,norma-lerner,"Widow of Al Lerner (d. 2002), Brooklyn-born immigrant&#8217;s son who built credit card giant MBNA, brought NFL back to Cleveland. Family still holds major stake in MBNA, though much reduced by taxman. Son, Randy, chairman of MBNA, took over football&#8217;s Cleveland Browns after father&#8217;s death from cancer; Norma served briefly on MBNA board. Daughter Nancy, a former prosecuting attorney, now active in family&#8217;s real estate investments. Family keeps low profile, but active in educational, medical philanthropy in Cleveland area.",488,billionaires,1400.0,0.0,221.0,"{'name': 'Norma Lerner', 'uri': 'norma-lerner', 'imageExists': True, 'squareImage': '//specials-images.forbesimg.com/imageserve/4c5034576f7f8449ebd38eb9eeedcf1c/416x416.jpg?background=000000&cropX1=0&cropX2=788&cropY1=42&cropY2=830'}",True,Norma Lerner,69.0,United States,Ohio,Cleveland,,['Finance'],United States,1337117304093,1337117342384,0.0,0.0,0.0,0.0,0,faris/5/2005/6565,496,True,-200.0,-12.5,False,D,F,-1065466800000.0,225.0,Lerner,Norma,The World's Billionaires,http://onforb.es/1IR6Yer,http://onforb.es/1KpFYny,http://onforb.es/1IR71XC,1109653200000,False,False,http://specials-images.forbesimg.com/imageserve/4c5034576f7f8449ebd38eb9eeedcf1c/280x425.jpg?fit=scale&background=000000,//specials-images.forbesimg.com/imageserve/4c5034576f7f8449ebd38eb9eeedcf1c/416x416.jpg?background=000000&cropX1=0&cropX2=788&cropY1=42&cropY2=830,False,,,,,,,,,,,,,,,,,,,,,,,,,,,,
400,Billionaires,2005,3,randolph-lerner,"Son of Al Lerner (d. 2002), Brooklyn-born immigrant&#8217;s son who built credit card giant MBNA, brought NFL back to Cleveland. Family still holds major stake in MBNA, though much reduced by taxman. Randy chairman of MBNA, took over football&#8217;s Cleveland Browns after father&#8217;s death from cancer; mother Norma served briefly on MBNA board. Sister Nancy, a former prosecuting attorney, now active in family&#8217;s real estate investments. Family keeps low profile, but active in educational, medical philanthropy in Cleveland area.",488,billionaires,1400.0,0.0,221.0,"{'name': 'Randolph Lerner', 'uri': 'randolph-lerner', 'imageExists': True, 'squareImage': '//specials-images.forbesimg.com/imageserve/56ce276fe4b062f6b59a7ef3/416x416.jpg?background=000000&cropX1=0&cropX2=744&cropY1=81&cropY2=825'}",True,Randolph Lerner,42.0,United States,Ohio,Cleveland,,['Finance'],United States,1337117346390,1337117388245,0.0,0.0,0.0,0.0,0,faris/5/2005/6169,497,True,-700.0,-33.33333333333334,False,D,M,-248036400000.0,225.0,Lerner,Randolph,The World's Billionaires,http://onforb.es/1IR6Yer,http://onforb.es/1KpG0fa,http://onforb.es/1IR71XC,1109653200000,False,False,http://specials-images.forbesimg.com/imageserve/56ce276fe4b062f6b59a7ef3/280x425.jpg?fit=scale&background=000000,//specials-images.forbesimg.com/imageserve/56ce276fe4b062f6b59a7ef3/416x416.jpg?background=000000&cropX1=0&cropX2=744&cropY1=81&cropY2=825,False,,,,,,,,,,,,,,,,,,,,,,,,,,,,
401,Billionaires,2005,3,george-lindemann,"Wharton grad made first fortune selling contact-lens-design company to Cooper Labs for $60 million in 1971. Acquired New Jersey cable licenses; sold Vision Cable for $220 million in 1982. Later built cell phone business Metro Mobile, sold to Bell Atlantic for $2.6 billion 1992. With family now holds 28% of natural gas distributor Southern Union, large stake in Verizon Communications. Family of equestrians: son Adam an avid polo player; daughter Sloan competes in jumping.",488,billionaires,1400.0,0.0,221.0,"{'name': 'George Lindemann & family', 'uri': 'george-lindemann', 'imageExists': True, 'squareImage': 'http://specials-images.forbesimg.com/imageserve/67c70c6aef6863d196e8a34b8300eeaa/416x416.jpg?background=000000&cropX1=69&cropX2=705&cropY1=39&cropY2=676'}",True,George Lindemann & family,69.0,United States,Florida,Palm Beach,,['Investments'],United States,1337117132203,1337117205442,0.0,0.0,0.0,0.0,0,faris/5/2005/5592,498,True,200.0,16.66666666666667,False,U,M,-1065639600000.0,225.0,Lindemann,George,The World's Billionaires,http://onforb.es/1IR6Yer,http://onforb.es/1zwu6tb,http://onforb.es/1IR71XC,1109653200000,False,False,http://specials-images.forbesimg.com/imageserve/67c70c6aef6863d196e8a34b8300eeaa/280x425.jpg?fit=scale&background=000000,http://specials-images.forbesimg.com/imageserve/67c70c6aef6863d196e8a34b8300eeaa/416x416.jpg?background=000000&cropX1=69&cropX2=705&cropY1=39&cropY2=676,False,,,,,,,,,,,,,,,,,,,,,,,,,,,,
402,Billionaires,2005,3,alfred-mann,"Lucrative year for friendly biotech investor: sold Advanced Bionics (neurostimulation) to Boston Scientific for $4.1 billion last year (remains co-CEO); took biomed research outfit MannKind public in August 2004. Born to English father and Polish mother, started selling magazines, lemonade during the Depression. Earned physics master&#8217;s from UCLA. Founded, sold aerospace companies Spectrolab and Helioteck 1960s. Funded Pacesetter Systems (rechargeable pacemakers), MiniMed (insulin pumps); sold companies to Medtronic for $4.2 billion in 2001. Committed philanthropist says he&#8217;ll donate his entire fortune to charity and research.",488,billionaires,1400.0,,,"{'name': 'Alfred Mann', 'uri': 'alfred-mann'}",True,Alfred Mann,79.0,United States,California,Los Angeles,,['Health Care'],United States,1309540326192,1309540358817,,,,,0,faris/5/2005/6747,499,,,,,,,,,,,,http://onforb.es/1IR6Yer,http://onforb.es/1BOUSEK,http://onforb.es/1IR71XC,1109653200000,False,False,http://specials-images.forbesimg.com/imageserve/56d0b386e4b0c144a7f65a54/280x425.jpg?fit=scale&background=000000,,False,0.0,0.0,0.0,0.0,0.0,0.0,0.0,0.0,0.0,0.0,0.0,0.0,0.0,0.0,0.0,0.0,0.0,0.0,0.0,,,,,,,,,
403,Billionaires,2005,3,marilyn-carlson-nelson,"Father, Curtis, borrowed $55 in 1938 to produce trading stamps for grocery store promotions. Became Gold Bond Stamp Co. Diversified into hotels 1960s (Radisson Hotels &#38; Resorts) and restaurants (T.G.I. Friday&#8217;s), travel agencies in 1970s. Renamed Carlson Cos. became travel-hospitality-marketing conglomerate: Radisson, Country Inns, Regent Hotels, Radisson Seven Seas Cruises, Carlson-Wagonlit travel agencies. Daughters inherited business after father&#8217;s death in 1999. Marilyn now the globetrotting chairman of $6.8 billion (sales) company. Overseeing major push into Asia. Sister, Barbara Gage (see), serves on the Carlson Cos. board of directors, runs family foundation, active with children&#8217;s charities.",488,billionaires,1400.0,,,"{'name': 'Marilyn Carlson Nelson & family', 'uri': 'marilyn-carlson-nelson'}",True,Marilyn Carlson Nelson & family,66.0,United States,Minnesota,Minneapolis,,,United States,1309539659070,1309539680623,,,,,0,faris/5/2005/6879,501,,,,,,,,,,,,http://onforb.es/1IR6Yer,http://onforb.es/1zwxVyL,http://onforb.es/1IR71XC,1109653200000,False,False,http://specials-images.forbesimg.com/imageserve/56d1c8c5e4b0c144a7f6662b/280x425.jpg?fit=scale&background=000000,,False,0.0,0.0,0.0,0.0,0.0,0.0,0.0,0.0,0.0,0.0,0.0,0.0,0.0,0.0,0.0,0.0,0.0,0.0,0.0,,,,,,,,,
404,Billionaires,2005,3,elena-baturina,"Powerful wife of Moscow Mayor Yuri Luzhkov started out as a factory worker, then entered the Moscow Institute of Management. Met Luzhkov in 1987 when they were both serving on the Mosgorispolcom, a Soviet-era municipal commission. In 1991 she started plastics-products company Inteko, which initially produced furniture and crockery but has since expanded into construction. The outfit is said to control as much as 20% of the city&#8217;s construction market. Now getting a jump on the vacation-home market in the resort town of Sochi.",507,billionaires,1300.0,,,"{'name': 'Elena Baturina', 'uri': 'elena-baturina', 'squareImage': '//specials-images.forbesimg.com/imageserve/5c71d32531358e35dd26fa5d/416x416.jpg?background=000000&cropX1=465&cropX2=2053&cropY1=177&cropY2=1764'}",True,Elena Baturina,42.0,Russia,,Moscow,,['Construction &#38; Engineering'],Russia,1309542030574,1309542049298,,,,,0,faris/5/2005/7632,506,,,,,,,,,,,,http://onforb.es/1IR6Yer,http://onforb.es/1zwyM2h,http://onforb.es/1IR71XC,1109653200000,False,False,http://specials-images.forbesimg.com/imageserve/5c71d32531358e35dd26fa5d/280x425.jpg?fit=scale&background=000000,//specials-images.forbesimg.com/imageserve/5c71d32531358e35dd26fa5d/416x416.jpg?background=000000&cropX1=465&cropX2=2053&cropY1=177&cropY2=1764,False,0.0,0.0,0.0,0.0,0.0,0.0,0.0,0.0,0.0,0.0,0.0,0.0,0.0,0.0,0.0,0.0,0.0,0.0,0.0,,,,,,,,,
405,Billionaires,2005,3,pierre-bellon,"Founder and chief of Sodexho, a catering, facilities management and river cruise company. In 2000 an accounting scandal spurred profit warnings. Chaos continued to reign last year with the resignations of three executives running the U.K. division, including Bellon&#8217;s son Francois-Xavier, who left for medical reasons. In 2003 three people died from an outbreak of E. coli at a California retirement community, possibly relating to  spoiled spinach provided by Sodexho. That incident prompted a lawsuit by victims&#8217; families and a settlement. It&#8217;s no wonder Bellon announced his retirement, effective September 2005, though he will remain busy as board chairman.",507,billionaires,1300.0,,,"{'name': 'Pierre Bellon & family', 'uri': 'pierre-bellon', 'squareImage': '//specials-images.forbesimg.com/imageserve/58a1c18ba7ea431f32196354/416x416.jpg?background=000000&cropX1=3&cropX2=718&cropY1=129&cropY2=844'}",True,Pierre Bellon & family,75.0,France,,Paris,,,France,1309540940501,1309540966009,,,,,0,faris/5/2005/7027,507,,,,,,,,,,,,http://onforb.es/1IR6Yer,http://onforb.es/1zwtxQg,http://onforb.es/1IR71XC,1109653200000,False,False,http://specials-images.forbesimg.com/imageserve/58a1c18ba7ea431f32196354/280x425.jpg?fit=scale&background=000000,//specials-images.forbesimg.com/imageserve/58a1c18ba7ea431f32196354/416x416.jpg?background=000000&cropX1=3&cropX2=718&cropY1=129&cropY2=844,False,0.0,0.0,0.0,0.0,0.0,0.0,0.0,0.0,0.0,0.0,0.0,0.0,0.0,0.0,0.0,0.0,0.0,0.0,0.0,,,,,,,,,
406,Billionaires,2005,3,chang-yung-fa,"Founder of the Evergreen Group, a large transportation group based in Taiwan with major shipping and aviation interests. Evergreen&#8217;s history dates back to 1968 when it operated small ships to transport cargo. Today it has a fleet of 100 container vessels and ranks as one of the world&#8217;s largest shipping companies. Last summer it announced plans to order more ships. The group&#8217;s two airlines, EVA and Uniair, are facing competition from discount carriers but recently were allowed to operate the first passenger flights in 50 years from Taiwan to mainland China for the Lunar New Year.",507,billionaires,1300.0,,,"{'name': 'Yung Fa Chang', 'uri': 'chang-yung-fa'}",True,Yung Fa Chang,78.0,Taiwan,,Taipei,,['Shipping'],Taiwan,1309542957361,1309542984017,,,,,0,faris/5/2005/4323,509,,,,,,,,,,,,http://onforb.es/1IR6Yer,http://onforb.es/1zwwxfg,http://onforb.es/1IR71XC,1109653200000,False,False,,,False,0.0,0.0,0.0,0.0,0.0,0.0,0.0,0.0,0.0,0.0,0.0,0.0,0.0,0.0,0.0,0.0,0.0,0.0,0.0,,,,,,,,,
407,Billionaires,2005,3,mark-cuban,"Clash of the egos as he pits his reality TV show, The Benefactor, against Donald Trump&#8217;s. Trump may have the ratings, but Cuban gets more screen time handing out challenges, deciding who merits a $1 million reward. Sold Internet broadcasting outfit Broadcast.com to Yahoo for $5.7 billion; shrewdly collared Yahoo stock before tech bust. Used windfall to buy Dallas mansion, Gulfstream jet, pro basketball&#8217;s Dallas Mavericks. Passionate owner eschews tinted-glass luxury box for courtside seats; racked up $1 million in fines for verbally abusing game officials, among other things. With Todd Wagner (see) invested in 2929 Entertainment: high-definition television network HDNet, art-house chain Landmark Theaters and Rysher Entertainment, which owns real estate. Perhaps the only member of The Forbes 400 to blog (www.blogmaverick.com).",507,billionaires,1300.0,,,"{'name': 'Mark Cuban', 'uri': 'mark-cuban', 'squareImage': 'https://specials-images.forbesimg.com/imageserve/632e1e3a4019629f2fdd5380/416x416.jpg?background=000000&cropX1=0&cropX2=1681&cropY1=221&cropY2=1903'}",True,Mark Cuban,47.0,United States,Texas,Dallas,,,United States,1309540014556,1309540066645,,,,,0,faris/5/2005/6808,510,,,,,,,,,,,,http://onforb.es/1IR6Yer,http://onforb.es/1BOU8zq,http://onforb.es/1IR71XC,1109653200000,False,False,http://specials-images.forbesimg.com/imageserve/632e1e3a4019629f2fdd5380/280x425.jpg?fit=scale&background=000000,https://specials-images.forbesimg.com/imageserve/632e1e3a4019629f2fdd5380/416x416.jpg?background=000000&cropX1=0&cropX2=1681&cropY1=221&cropY2=1903,False,0.0,0.0,0.0,0.0,0.0,0.0,0.0,0.0,0.0,0.0,0.0,0.0,0.0,0.0,0.0,0.0,0.0,0.0,0.0,,,,,,,,,
408,Billionaires,2005,3,barry-diller,"With pal David Geffen (see), cut teeth in fabled mailroom of Hollywood&#8217;s William Morris Agency. A media darling ever since: in the movie business (Paramount, under Michael Eisner), in television (ABC, Fox, USA Networks), now the Internet. Claims he became an e-commerce acolyte after watching Diane von Furstenberg sell clothes online; later married her. Now runs InterActiveCorp, growing blend of Internet sites: travel  (Expedia.com, Hotels.com), personal (LendingTree.com, Match.com), entertainment (Ticketmaster.com). Shrewd negotiator, personally reaped $275 million when NBC bought his old TV assets from Vivendi.",507,billionaires,1300.0,,,"{'name': 'Barry Diller', 'uri': 'barry-diller', 'squareImage': 'https://specials-images.forbesimg.com/imageserve/5f4978612579aa24ec628b58/416x416.jpg?background=000000&cropX1=386&cropX2=4439&cropY1=1209&cropY2=5263'}",True,Barry Diller,63.0,United States,New York,New York,,['Media'],United States,1309540525123,1309540565267,,,,,0,faris/5/2005/6049,511,,,,,,,,,,,,http://onforb.es/1IR6Yer,http://onforb.es/1BOUrtQ,http://onforb.es/1IR71XC,1109653200000,False,False,http://specials-images.forbesimg.com/imageserve/5f4978612579aa24ec628b58/280x425.jpg?fit=scale&background=000000,https://specials-images.forbesimg.com/imageserve/5f4978612579aa24ec628b58/416x416.jpg?background=000000&cropX1=386&cropX2=4439&cropY1=1209&cropY2=5263,False,0.0,0.0,0.0,0.0,0.0,0.0,0.0,0.0,0.0,0.0,0.0,0.0,0.0,0.0,0.0,0.0,0.0,0.0,0.0,,,,,,,,,
409,Billionaires,2005,3,abilio-dos-santos-diniz,"The leader of Brazil&#8217;s largest retailer, Companhia Brasileira de Distribuicao, stepped down as chief executive in December 2002 but as chairman still goes to the office every day. The company has managed to hold its own against competition from global giants Wal-Mart and Carrefour. Diniz married for the third time last year, to a CBD executive some 35 years his junior. He stays fit by spending three hours a day playing squash and working out.",507,billionaires,1300.0,,,"{'name': 'Abilio dos Santos Diniz', 'uri': 'abilio-dos-santos-diniz', 'squareImage': 'https://specials-images.forbesimg.com/imageserve/603e8f5d4a2df75cef4fb25a/416x416.jpg?background=000000&cropX1=0&cropX2=800&cropY1=0&cropY2=800'}",True,Abilio dos Santos Diniz,68.0,Brazil,,Sao Paulo,,['Retail'],Brazil,1309539699077,1309539725893,,,,,0,faris/5/2005/4278,512,,,,,,,,,,,,http://onforb.es/1IR6Yer,http://onforb.es/1BOTP7D,http://onforb.es/1IR71XC,1109653200000,False,False,http://specials-images.forbesimg.com/imageserve/603e8f5d4a2df75cef4fb25a/280x425.jpg?fit=scale&background=000000,https://specials-images.forbesimg.com/imageserve/603e8f5d4a2df75cef4fb25a/416x416.jpg?background=000000&cropX1=0&cropX2=800&cropY1=0&cropY2=800,False,0.0,0.0,0.0,0.0,0.0,0.0,0.0,0.0,0.0,0.0,0.0,0.0,0.0,0.0,0.0,0.0,0.0,0.0,0.0,,,,,,,,,
410,Billionaires,2005,3,david-duffield,Cofounder of PeopleSoft saw personal holdings jump after Oracle was given approval to buy his software manufacturer. Handed over day-to-day control to Oracle sales vet Craig Conway in 1999; remains chairman. Main diversion: overseeing the $150 million Maddie&#39s Fund (named after his late miniature schnauzer) to help make America a &#8220;no-kill&#8221; zone for unwanted pets.,507,billionaires,1300.0,,,"{'name': 'David Duffield', 'uri': 'david-duffield', 'squareImage': 'https://specials-images.forbesimg.com/imageserve/ed18bc09e156f93af21f12d3b3bc2ff2/416x416.jpg?background=000000&cropX1=110&cropX2=646&cropY1=168&cropY2=705'}",True,David Duffield,64.0,United States,Nevada,Incline Village,,,United States,1309543196913,1309543248831,,,,,0,faris/5/2005/5651,513,,,,,,,,,,,,http://onforb.es/1IR6Yer,http://onforb.es/1zwteok,http://onforb.es/1IR71XC,1109653200000,False,False,http://specials-images.forbesimg.com/imageserve/ed18bc09e156f93af21f12d3b3bc2ff2/280x425.jpg?fit=scale&background=000000,https://specials-images.forbesimg.com/imageserve/ed18bc09e156f93af21f12d3b3bc2ff2/416x416.jpg?background=000000&cropX1=110&cropX2=646&cropY1=168&cropY2=705,False,0.0,0.0,0.0,0.0,0.0,0.0,0.0,0.0,0.0,0.0,0.0,0.0,0.0,0.0,0.0,0.0,0.0,0.0,0.0,,,,,,,,,
411,Billionaires,2005,3,gabriel-escarrer,"Returns to the billionaire ranks this year, thanks to a rebound in tourism. Opened his first hotel in Palma de Mallorca in 1956. Now his Sol Melia is the leading hotel company in Spain, Latin America and the Caribbean and ranks twelfth in the world. Properties include 350 hotels in 30 countries; has 24 hotels in Cuba. Still runs the company with help of two sons who work there. Avid golfer.",507,billionaires,1300.0,,,"{'name': 'Gabriel Escarrer', 'uri': 'gabriel-escarrer', 'squareImage': '//specials-images.forbesimg.com/imageserve/5c7216b931358e35dd26fe36/416x416.jpg?background=000000&cropX1=129&cropX2=486&cropY1=3&cropY2=360'}",True,Gabriel Escarrer,70.0,Spain,,Palma de Majorca,,,Spain,1309542368054,1309542382593,,,,,0,faris/5/2005/4402,514,,,,,,,,,,,,http://onforb.es/1IR6Yer,http://onforb.es/1BOUOov,http://onforb.es/1IR71XC,1109653200000,False,False,http://specials-images.forbesimg.com/imageserve/5c7216b931358e35dd26fe36/280x425.jpg?fit=scale&background=000000,//specials-images.forbesimg.com/imageserve/5c7216b931358e35dd26fe36/416x416.jpg?background=000000&cropX1=129&cropX2=486&cropY1=3&cropY2=360,False,0.0,0.0,0.0,0.0,0.0,0.0,0.0,0.0,0.0,0.0,0.0,0.0,0.0,0.0,0.0,0.0,0.0,0.0,0.0,,,,,,,,,
412,Billionaires,2005,3,doris-fisher,"Former real estate developer Donald and wife, Doris (see,) founded Gap as a San Francisco jeans and music store in 1969. Six stores opened within first year. Pioneered customer convenience by arranging by size, not style. Now over 3,000 locations with expanded empire including Banana Republic (1983), Gap Kids (1986) and Old Navy (1994.) Last year, after 35 years running Gap, handed control of company, and nearly half their stock holdings, to their three sons.",507,billionaires,1300.0,0.0,234.0,"{'name': 'Doris Fisher', 'uri': 'doris-fisher', 'imageExists': True, 'squareImage': '//specials-images.forbesimg.com/imageserve/8f509677141935bbb172e12367d1e853/416x416.jpg?background=000000&cropX1=0&cropX2=744&cropY1=106&cropY2=850'}",True,Doris Fisher,73.0,United States,California,San Francisco,,['Fashion and Retail            '],United States,1347995845953,1347995905473,0.0,0.0,0.0,0.0,0,faris/5/2005/5203,516,True,-800.0,-38.095238095238095,False,D,F,-1210536000000.0,225.0,Fisher,Doris,The World's Billionaires,http://onforb.es/1IR6Yer,http://onforb.es/1BOU1DV,http://onforb.es/1IR71XC,1109653200000,False,False,http://specials-images.forbesimg.com/imageserve/8f509677141935bbb172e12367d1e853/280x425.jpg?fit=scale&background=000000,//specials-images.forbesimg.com/imageserve/8f509677141935bbb172e12367d1e853/416x416.jpg?background=000000&cropX1=0&cropX2=744&cropY1=106&cropY2=850,False,,,,,,,,,,,,,,,,,,,,,,,Fashion and Retail,Cofounder,Gap,"{'name': 'Gap', 'uri': 'companies/gap', 'title': 'Cofounder', 'totalEarningEst': False, 'salaryEst': False, 'government': False}",,
413,Billionaires,2005,3,john-gandel,"The billionaire jack-of-all-trades. While most of his wealth is tied up in the CFS Gandel Retail Trust, a $2.5 billion (market capitalization) real estate investment trust, Gandel also directly owns or shares ownership in two Australian shopping centers and five retirement villages. It all started when he inherited a woman&#39s clothing retailer from his parents, Polish immigrants who arrived in Melbourne just before World War II. Sold it in 1985 to his brother-in-law. Proceeds helped him develop Australia&#8217;s Priceline, a discount retailer of women&#39s cosmetics and beauty products. He and his wife collect Japanese art.",507,billionaires,1300.0,,,"{'name': 'John Gandel', 'uri': 'john-gandel', 'squareImage': 'https://specials-images.forbesimg.com/imageserve/6050f48ca1ab099ed6e290cc/416x416.jpg?background=000000&cropX1=0&cropX2=800&cropY1=0&cropY2=800'}",True,John Gandel,70.0,Australia,,Melbourne,,['Real Estate'],Australia,1309539650896,1309539669936,,,,,0,faris/5/2005/7499,519,,,,,,,,,,,,http://onforb.es/1IR6Yer,http://onforb.es/1zwtKTx,http://onforb.es/1IR71XC,1109653200000,False,False,http://specials-images.forbesimg.com/imageserve/6050f48ca1ab099ed6e290cc/280x425.jpg?fit=scale&background=000000,https://specials-images.forbesimg.com/imageserve/6050f48ca1ab099ed6e290cc/416x416.jpg?background=000000&cropX1=0&cropX2=800&cropY1=0&cropY2=800,False,0.0,0.0,0.0,0.0,0.0,0.0,0.0,0.0,0.0,0.0,0.0,0.0,0.0,0.0,0.0,0.0,0.0,0.0,0.0,,,,,,,,,
