,name,year,month,uri,bio,rank,listUri,finalWorth,otherCompensation,countryRank,person,visible,personName,age,country,state,city,source,industries,countryOfCitizenship,timestamp,version,moneyRank,tvRadioRank,pressRank,webRank,socialRank,naturalId,position,imageExists,change,changePercent,selfMade,status,gender,birthDate,countryId,lastName,firstName,listDescription,shortUri,galleryShortUri,listShortUri,date,wealthList,familyList,thumbnail,squareImage,bioSuppress,factivaHits,webHits,tvRadio,recentEarnings,recentSales,recentBudget,gdp,budget,assets,totalCompensation,salary,bonus,stockOptions,population,audienceWeb,audiencePrint,audienceTv,employees,following,previousRank,csfDisplayFields,suppressOnProfiles,category,title,organization,employment,portraitImage,landscapeImage
247,Billionaires,2005,3,francesco-gaetano-caltagirone,"Owns over 50% of Caltagirone SpA, the industrial holding company which has cement, media and real estate interests. His Cementir subsidiary recently plowed its way into China, buying a Shanghai plant for $7.5 million. A vocal shareholder activist, he leads a group of shareholders at Banca Nazionale del Lavoro reportedly pushing for management change. Banca Monte dei Paschi di Siena, of which he is also a shareholder and board member, rejected an invitation to join the rebel shareholder pact at Banca Nazionale del Lavoro. In recent years unsuccessfully bid for Metrovacesa, a Spanish property holding company.",306,billionaires,2100.0,,,"{'name': 'Francesco Gaetano Caltagirone', 'uri': 'francesco-gaetano-caltagirone', 'squareImage': '//specials-images.forbesimg.com/imageserve/5e76d3f1c7b02d000666d2fc/416x416.jpg?background=000000&cropX1=865&cropX2=2685&cropY1=125&cropY2=1946'}",True,Francesco Gaetano Caltagirone,62.0,Italy,,,,,Italy,1309541627975,1309541642478,,,,,0,faris/5/2005/7044,306,,,,,,,,,,,,http://onforb.es/1IR6Yer,http://onforb.es/1zwvrQJ,http://onforb.es/1IR71XC,1109653200000,False,False,http://specials-images.forbesimg.com/imageserve/5e76d3f1c7b02d000666d2fc/280x425.jpg?fit=scale&background=000000,//specials-images.forbesimg.com/imageserve/5e76d3f1c7b02d000666d2fc/416x416.jpg?background=000000&cropX1=865&cropX2=2685&cropY1=125&cropY2=1946,False,0.0,0.0,0.0,0.0,0.0,0.0,0.0,0.0,0.0,0.0,0.0,0.0,0.0,0.0,0.0,0.0,0.0,0.0,0.0,,,,,,,,,
248,Billionaires,2005,3,gordon-getty,"Son of oil baron J. Paul Getty Sr. (d. 1976). Spent 4 years in family business, then opted for the esthetic life; studied music at the San Francisco Conservatory. Sold family&#8217;s Getty Oil to Texaco for $10 billion 1986. Now a committed composer; works include &#8220;Joan and the Bells,&#8221; &#8220;The White Election&#8221; and &#8220;Victorian Scenes.&#8221; Baseball fan still dabbles in business: funding ReFlow, outfit that buys illiquid shares from mutual funds. Also founded winery, resort and restaurant business under PlumpJack name.",306,billionaires,2100.0,0.0,107.0,"{'name': 'Gordon Getty', 'uri': 'gordon-getty', 'imageExists': True, 'squareImage': '//specials-images.forbesimg.com/imageserve/5ba67f0d4bbe6f79516f6c24/416x416.jpg?background=000000&cropX1=504&cropX2=1789&cropY1=108&cropY2=1394'}",True,Gordon Getty,72.0,United States,California,San Francisco,,['Energy'],United States,1337117174421,1337117217045,0.0,0.0,0.0,0.0,0,faris/5/2005/7000,307,True,0.0,0.0,False,E,M,-1137092400000.0,225.0,Getty,Gordon,The World's Billionaires,http://onforb.es/1IR6Yer,http://onforb.es/1zwwC2x,http://onforb.es/1IR71XC,1109653200000,False,False,http://specials-images.forbesimg.com/imageserve/5ba67f0d4bbe6f79516f6c24/280x425.jpg?fit=scale&background=000000,//specials-images.forbesimg.com/imageserve/5ba67f0d4bbe6f79516f6c24/416x416.jpg?background=000000&cropX1=504&cropX2=1789&cropY1=108&cropY2=1394,False,,,,,,,,,,,,,,,,,,,,,,,,,,,,
249,Billionaires,2005,3,german-khan,"In the 1980s Khan studied at the Moscow Institute of Steel &#38; Alloys, where he met several members of what would later become the Alfa Group, headed by Mikhail Fridman. Khan became the point man for the group&#8217;s most lucrative business line, trading house Alfa-Eco. By 1994 Khan had helped make Alfa-Eco one of Russia&#8217;s largest private oil traders and had helped set up a big oil-for-sugar deal with Cuba. Last year Alfa-Eco was named in an investigation into Iraq&#8217;s oil-for-food deal. The company denies the charges. When Alfa took over oil giant TNK, it was Khan who was chosen to run the operation. Today TNK is half-owned by BP, but Khan remains executive director.",306,billionaires,2100.0,,,"{'name': 'German Khan', 'uri': 'german-khan', 'squareImage': 'https://specials-images.forbesimg.com/imageserve/62471c96d9d016541f503f31/416x416.jpg?background=000000&cropX1=640&cropX2=3303&cropY1=0&cropY2=2660'}",True,German Khan,43.0,Russia,,Moscow,,['Oil'],Russia,1309538583112,1309538609043,,,,,0,faris/5/2005/7491,309,,,,,,,,,,,,http://onforb.es/1IR6Yer,http://onforb.es/1BOTrpM,http://onforb.es/1IR71XC,1109653200000,False,False,http://specials-images.forbesimg.com/imageserve/62471c96d9d016541f503f31/280x425.jpg?fit=scale&background=000000,https://specials-images.forbesimg.com/imageserve/62471c96d9d016541f503f31/416x416.jpg?background=000000&cropX1=640&cropX2=3303&cropY1=0&cropY2=2660,False,0.0,0.0,0.0,0.0,0.0,0.0,0.0,0.0,0.0,0.0,0.0,0.0,0.0,0.0,0.0,0.0,0.0,0.0,0.0,,,,,,,,,
250,Billionaires,2005,3,herbert-kohler-jr,"Chrome and porcelain still turning to gold for third-generation chief of plumbing business started in 1873. With sister Ruth, controls estimated $3.2 billion-sales Kohler empire: toilets, sinks, furniture, cabinets, engines, generators. Also golf: owns Whistling Straits course on Lake Michigan, site of last year&#8217;s PGA championship.",306,billionaires,2100.0,,,"{'name': 'Herbert Kohler & family', 'uri': 'herbert-kohler-jr', 'squareImage': 'https://specials-images.forbesimg.com/imageserve/5f4e6f58de56f2aac9de396e/416x416.jpg?background=000000&cropX1=0&cropX2=2927&cropY1=220&cropY2=3149'}",True,Herbert Kohler & family,66.0,United States,Wisconsin,Kohler,,['Manufacturing'],United States,1309542044987,1309542069283,,,,,0,faris/5/2005/5889,310,,,,,,,,,,,,http://onforb.es/1IR6Yer,http://onforb.es/1zwtnZ2,http://onforb.es/1IR71XC,1109653200000,False,False,http://specials-images.forbesimg.com/imageserve/5f4e6f58de56f2aac9de396e/280x425.jpg?fit=scale&background=000000,https://specials-images.forbesimg.com/imageserve/5f4e6f58de56f2aac9de396e/416x416.jpg?background=000000&cropX1=0&cropX2=2927&cropY1=220&cropY2=3149,False,0.0,0.0,0.0,0.0,0.0,0.0,0.0,0.0,0.0,0.0,0.0,0.0,0.0,0.0,0.0,0.0,0.0,0.0,0.0,,,,,,,,,
251,Billionaires,2005,3,craig-mccaw,"One of three surviving sons of cable pioneer John Elroy McCaw (youngest son, Keith, died 2002). Sons took over business after father&#8217;s death in 1969; Craig turned frail cable concern into cellular phone giant. Sold to AT&#38;T for $11.5 billion in 1993. Invested proceeds in Nextel, other tech investments, but got hit hard in telecom crash. Still in the game with satellite company ICO, cellular outfit Microcell.",306,billionaires,2100.0,0.0,107.0,"{'name': 'Craig McCaw', 'uri': 'craig-mccaw', 'imageExists': True, 'squareImage': '//specials-images.forbesimg.com/imageserve/5a8ed8b831358e4955ae0801/416x416.jpg?background=000000&cropX1=2340&cropX2=3117&cropY1=334&cropY2=1110'}",True,Craig McCaw,55.0,United States,Washington,Hunts Point,,['Media'],United States,1337117134609,1337117205001,0.0,0.0,0.0,0.0,0,faris/5/2005/5649,311,True,-700.0,-25.0,False,D,M,-643492800000.0,225.0,McCaw,Craig,The World's Billionaires,http://onforb.es/1IR6Yer,http://onforb.es/1zwvJqU,http://onforb.es/1IR71XC,1109653200000,False,False,http://specials-images.forbesimg.com/imageserve/5a8ed8b831358e4955ae0801/280x425.jpg?fit=scale&background=000000,//specials-images.forbesimg.com/imageserve/5a8ed8b831358e4955ae0801/416x416.jpg?background=000000&cropX1=2340&cropX2=3117&cropY1=334&cropY2=1110,False,,,,,,,,,,,,,,,,,,,,,,,,,,,,
252,Billionaires,2005,3,richard-rainwater,"Stanford business grad got start managing Bass family&#8217;s $50 million portfolio in 1970; lost money first 2 years. Acquired large stake in Disney 1984, went solo 2 years later. Cofounded Columbia Hospital 1987, bought Hospital Corporation of America 1994. Sold HCA stake last year, invested proceeds in Tenet Healthcare. Recently shedding oil and gas assets for additional liquidity; says he&#8217;s on the prowl for other buying opportunities. Purchased 3 million shares of Global Crossing last year, now owns 7.5% of beleaguered telecom. &#8220;I&#8217;m doing better than I&#8217;ve ever done. I&#8217;m happy, healthy, wealthy and wise, and that&#8217;s about it.&#8221; Wife, Darla Moore, a dealmaker in her own right, managing sizable assets since 1994.",306,billionaires,2100.0,,,"{'name': 'Richard Rainwater', 'uri': 'richard-rainwater'}",True,Richard Rainwater,60.0,United States,Texas,Fort Worth,,['Finance'],United States,1309538844630,1309538904739,,,,,0,faris/5/2005/5139,312,,,,,,,,,,,,http://onforb.es/1IR6Yer,http://onforb.es/1zwuqYZ,http://onforb.es/1IR71XC,1109653200000,False,False,http://specials-images.forbesimg.com/imageserve/8974433f2841ca176b46ef7c6532159f/280x425.jpg?fit=scale&background=000000,,False,0.0,0.0,0.0,0.0,0.0,0.0,0.0,0.0,0.0,0.0,0.0,0.0,0.0,0.0,0.0,0.0,0.0,0.0,0.0,,,,,,,,,
253,Billionaires,2005,3,harold-simmons,"Schoolteacher&#8217;s son got start as bank examiner, bought Dallas drugstore for $5,000 in 1961. Built into 100-store chain; sold to Eckerd for $50 million 12 years later. Went on shopping spree: chemicals, oil services, timber, sugar, fast food. Cached most of his holdings in publicly traded Valhi: metals, titanium dioxide, waste management. Legislation allowing burial of low-level nuclear waste in western Texas could be boon to business.",306,billionaires,2100.0,,,"{'name': 'Harold Simmons', 'uri': 'harold-simmons'}",True,Harold Simmons,73.0,United States,Texas,Dallas,,['Investments'],United States,1309539763656,1309539815277,,,,,0,faris/5/2005/5494,313,,,,,,,,,,,,http://onforb.es/1IR6Yer,http://onforb.es/SkcqBN,http://onforb.es/1IR71XC,1109653200000,False,False,,,False,0.0,0.0,0.0,0.0,0.0,0.0,0.0,0.0,0.0,0.0,0.0,0.0,0.0,0.0,0.0,0.0,0.0,0.0,0.0,,,,,,,,,
254,Billionaires,2005,3,fred-smith-1,"Yale economics undergrad wrote thesis on improving delivery services via integrated network of planes and trucks. Worked as crop pilot, bought small stake in Arkansas aviation firm; turned into courier service Federal Express. Last year acquired Kinko&#8217;s for $2.4 billion. Also finances Alcon Entertainment (Chasing Liberty, My Dog Skip), minority owner of the Washington Redskins football team.",306,billionaires,2100.0,0.0,107.0,"{'name': 'Frederick Smith', 'uri': 'fred-smith-1', 'imageExists': False, 'squareImage': '//specials-images.forbesimg.com/imageserve/5d8adf516de3150009a506c7/416x416.jpg?background=000000&cropX1=1182&cropX2=2976&cropY1=126&cropY2=1919'}",True,Frederick Smith,60.0,United States,Tennessee,Memphis,,['Logistics'],United States,1337117134609,1337117202551,0.0,0.0,0.0,0.0,0,faris/5/2005/5293,314,False,700.0,50.0,False,U,M,-801259200000.0,225.0,Smith,Frederick,The World's Billionaires,http://onforb.es/1IR6Yer,http://onforb.es/1BOTVvV,http://onforb.es/1IR71XC,1109653200000,False,False,http://specials-images.forbesimg.com/imageserve/5d8adf516de3150009a506c7/280x425.jpg?fit=scale&background=000000,//specials-images.forbesimg.com/imageserve/5d8adf516de3150009a506c7/416x416.jpg?background=000000&cropX1=1182&cropX2=2976&cropY1=126&cropY2=1919,False,,,,,,,,,,,,,,,,,,,,,,,,,,,,
255,Billionaires,2005,3,jon-stryker,"Grandchild of Homer Stryker (d. 1980), orthopedic surgeon who invented mobile hospital beds. Founded medical supply company Stryker Corp., heirs now control 30% of the company. When father, Lee, died in 1977 plane crash, John Brown (see) took over company. Architect Jon founder of Arcus Foundation, focuses on gay and lesbian rights, animal conservation.",306,billionaires,2100.0,,,"{'name': 'Jon Stryker', 'uri': 'jon-stryker', 'squareImage': '//specials-images.forbesimg.com/imageserve/5d8ad82e18444200084e723a/416x416.jpg?background=000000&cropX1=41&cropX2=941&cropY1=43&cropY2=944'}",True,Jon Stryker,46.0,United States,Michigan,Kalamazoo,,['Health Care'],United States,1309540325078,1309540360405,,,,,0,faris/5/2005/6917,315,,,,,,,,,,,,http://onforb.es/1IR6Yer,http://onforb.es/1zwvvjn,http://onforb.es/1IR71XC,1109653200000,False,False,http://specials-images.forbesimg.com/imageserve/5d8ad82e18444200084e723a/280x425.jpg?fit=scale&background=000000,//specials-images.forbesimg.com/imageserve/5d8ad82e18444200084e723a/416x416.jpg?background=000000&cropX1=41&cropX2=941&cropY1=43&cropY2=944,False,0.0,0.0,0.0,0.0,0.0,0.0,0.0,0.0,0.0,0.0,0.0,0.0,0.0,0.0,0.0,0.0,0.0,0.0,0.0,,,,,,,,,
256,Billionaires,2005,3,ronda-stryker,"Grandchild of Homer Stryker (d. 1980), orthopedic surgeon who invented mobile hospital beds. Founded medical supply company Stryker Corp., heirs now control 30% of the company. When father, Lee, died in 1977 plane crash, John Brown (see) took over company. Ronda the only family member to sit on board.",306,billionaires,2100.0,,,"{'name': 'Ronda Stryker', 'uri': 'ronda-stryker', 'squareImage': '//specials-images.forbesimg.com/imageserve/55fa1ca9e4b0ffa7afe4ad5a/416x416.jpg?background=000000&cropX1=0&cropX2=744&cropY1=81&cropY2=825'}",True,Ronda Stryker,50.0,United States,Michigan,Kalamazoo,,['Health Care'],United States,1309539365458,1309539386174,,,,,0,faris/5/2005/6919,316,,,,,,,,,,,,http://onforb.es/1IR6Yer,http://onforb.es/1zwu5Wh,http://onforb.es/1IR71XC,1109653200000,False,False,http://specials-images.forbesimg.com/imageserve/55fa1ca9e4b0ffa7afe4ad5a/280x425.jpg?fit=scale&background=000000,//specials-images.forbesimg.com/imageserve/55fa1ca9e4b0ffa7afe4ad5a/416x416.jpg?background=000000&cropX1=0&cropX2=744&cropY1=81&cropY2=825,False,0.0,0.0,0.0,0.0,0.0,0.0,0.0,0.0,0.0,0.0,0.0,0.0,0.0,0.0,0.0,0.0,0.0,0.0,0.0,,,,,,,,,
257,Billionaires,2005,3,nikolai-tsvetkov,"Like Lukoil&#8217;s Leonid Fedun, Tsvetkov started out in the military. He graduated from the Air-Army Engineering Academy, served with Soviet forces in Afghanistan and reached the rank of lieutenant colonel. When the Soviet Union collapsed, Tsvetkov started a new career as an investment banker. In 1993, he established investment company Nikoil, whose first task was to make sure that the managers of new oil company Lukoil would be the big winners in their company&#8217;s 1994 privatization. Today Tsvetkov has a big stake in Lukoil; his investment bank, Nikoil, has acquired retail bank UralSib to become one of Russia&#8217;s largest private financial institutions.",306,billionaires,2100.0,,,"{'name': 'Nikolai Tsvetkov', 'uri': 'nikolai-tsvetkov'}",True,Nikolai Tsvetkov,44.0,Russia,,Moscow,,['Oil'],Russia,1309543153836,1309543178663,,,,,0,faris/5/2005/7497,317,,,,,,,,,,,,http://onforb.es/1IR6Yer,http://onforb.es/1zwxapo,http://onforb.es/1IR71XC,1109653200000,False,False,,,False,0.0,0.0,0.0,0.0,0.0,0.0,0.0,0.0,0.0,0.0,0.0,0.0,0.0,0.0,0.0,0.0,0.0,0.0,0.0,,,,,,,,,
258,Billionaires,2005,3,patrick-wang,"Heads Johnson Electric, one of the world&#8217;s leading manufacturers of minimotors, founded in 1959 by his parents to make motors for toy boats. These days the motors are found in antilock braking systems, power drills, seat adjusters and blood pressure pumps. Year-end net profits were down 22% last year, due to rising copper and steel prices. Wang holds a master&#8217;s degree in electrical engineering from Purdue University in Indiana.",306,billionaires,2100.0,0.0,10.0,"{'name': 'Patrick Wang', 'uri': 'patrick-wang', 'imageExists': True}",True,Patrick Wang,54.0,Hong Kong,,Hong Kong,,['Manufacturing'],Hong Kong,1491347008066,1,0.0,,0.0,,0,faris/5/2005/4640,318,True,-700.0,-25.0,False,D,M,-610142400000.0,227.0,Wang,Patrick,The World's Billionaires,,,,1110430800000,False,False,http://specials-images.forbesimg.com/imageserve/7f754dad262997d15e69baf69436bb3a/131x200.jpg,,False,,,,,,,,,,,,,,,,,,,,176.0,"['rank', 'finalWorth', 'personName', 'bios', 'bio']",False,Manufacturing,,,,,
259,Billionaires,2005,3,steve-wynn,"Casino visionary preparing for April opening of Wynn Las Vegas: $2.7 billion resort with 2,700 rooms, Ferrari dealership, permanent space for Wynn&#8217;s vaunted art collection. Son of a New York bingo parlor operator became keno manager at Frontier Hotel in Las Vegas. Bought Golden Nugget casino before building the Mirage, Treasure Island and Bellagio themed resorts. Sold Mirage to Kirk Kerkorian for $6.4 billion in 2000. Took Wynn Resorts public 2002: stock up 471% since offering. Now setting sights on Asia. Broke ground on Wynn Macau, $700 million casino in Far East gambling mecca.",306,billionaires,2100.0,,,"{'name': 'Stephen Wynn', 'uri': 'steve-wynn', 'squareImage': 'https://specials-images.forbesimg.com/imageserve/5f492f19b83ec6ab5858e438/416x416.jpg?background=000000&cropX1=777&cropX2=3114&cropY1=80&cropY2=2418'}",True,Stephen Wynn,64.0,United States,Nevada,Las Vegas,,,United States,1309538887389,1309538916270,,,,,0,faris/5/2005/6523,319,,,,,,,,,,,,http://onforb.es/1IR6Yer,http://onforb.es/1BOU1no,http://onforb.es/1IR71XC,1109653200000,False,False,http://specials-images.forbesimg.com/imageserve/5f492f19b83ec6ab5858e438/280x425.jpg?fit=scale&background=000000,https://specials-images.forbesimg.com/imageserve/5f492f19b83ec6ab5858e438/416x416.jpg?background=000000&cropX1=777&cropX2=3114&cropY1=80&cropY2=2418,False,0.0,0.0,0.0,0.0,0.0,0.0,0.0,0.0,0.0,0.0,0.0,0.0,0.0,0.0,0.0,0.0,0.0,0.0,0.0,,,,,,,,,
260,Billionaires,2005,3,herbert-allen-jr,"Low-profile investment bank Allen &#38; Co. has had a stellar run: claims to have had returns of more than 40% a year since the mid-1980s. Firm has long tradition of forging lucrative relationships with corporate leaders. Host of annual retreat for media bigwigs in Sun Valley, Idaho helped spawn some high-profile mergers like Disney and ABC. This year&#8217;s guests included many of The Forbes 400: Bill Gates, Barry Diller, Rupert Murdoch, Meg Whitman. Board member and large investor in Coca-Cola travels everywhere with Donnie, his black Labrador.",321,billionaires,2000.0,,,"{'name': 'Herbert Allen & family', 'uri': 'herbert-allen-jr', 'squareImage': '//specials-images.forbesimg.com/imageserve/56d0d6d0e4b0c144a7f65d76/416x416.jpg?background=000000&cropX1=34&cropX2=675&cropY1=15&cropY2=656'}",True,Herbert Allen & family,65.0,United States,New York,New York,,['Finance'],United States,1309540950590,1309540995391,,,,,0,faris/5/2005/5862,320,,,,,,,,,,,,http://onforb.es/1IR6Yer,http://onforb.es/1zwwRuF,http://onforb.es/1IR71XC,1109653200000,False,False,http://specials-images.forbesimg.com/imageserve/56d0d6d0e4b0c144a7f65d76/280x425.jpg?fit=scale&background=000000,//specials-images.forbesimg.com/imageserve/56d0d6d0e4b0c144a7f65d76/416x416.jpg?background=000000&cropX1=34&cropX2=675&cropY1=15&cropY2=656,False,0.0,0.0,0.0,0.0,0.0,0.0,0.0,0.0,0.0,0.0,0.0,0.0,0.0,0.0,0.0,0.0,0.0,0.0,0.0,,,,,,,,,
261,Billionaires,2005,3,isak-andic,"Owns and runs $1.3 billion (sales) Mango, makers of reasonably priced trendy women&#8217;s apparel. Opened his first store in Barcelona in 1984; now has 700 locations in 73 countries. A very private man, little is known about him other than the fact that his family came to Spain from Turkey in the 1960s and that he is rumored to love sailing.",321,billionaires,2000.0,,,"{'name': 'Isak Andic', 'uri': 'isak-andic', 'squareImage': '//specials-images.forbesimg.com/imageserve/5e77bde4d8e1ae0007b73505/416x416.jpg?background=000000&cropX1=1135&cropX2=3446&cropY1=58&cropY2=2370'}",True,Isak Andic,50.0,Spain,,Barcelona,,['Retail'],Spain,1309539221255,1309539239331,,,,,0,faris/5/2005/7414,321,,,,,,,,,,,,http://onforb.es/1IR6Yer,http://onforb.es/1BOTKAZ,http://onforb.es/1IR71XC,1109653200000,False,False,http://specials-images.forbesimg.com/imageserve/5e77bde4d8e1ae0007b73505/280x425.jpg?fit=scale&background=000000,//specials-images.forbesimg.com/imageserve/5e77bde4d8e1ae0007b73505/416x416.jpg?background=000000&cropX1=1135&cropX2=3446&cropY1=58&cropY2=2370,False,0.0,0.0,0.0,0.0,0.0,0.0,0.0,0.0,0.0,0.0,0.0,0.0,0.0,0.0,0.0,0.0,0.0,0.0,0.0,,,,,,,,,
262,Billionaires,2005,3,matthew-bucksbaum,"Former supermarket manager started developing shopping centers in Iowa with late brother Martin in 1954. Took General Growth Properties public in 1993. Relocated to Chicago. Still serves as chairman, but son John oversees company's 200 million square feet of mall space.",321,billionaires,2000.0,,,"{'name': 'Matthew Bucksbaum & family', 'uri': 'matthew-bucksbaum'}",True,Matthew Bucksbaum & family,79.0,United States,Illinois,Chicago,,['Real Estate'],United States,1309540514590,1309540535194,,,,,0,faris/5/2005/7707,324,,,,,,,,,,,,http://onforb.es/1IR6Yer,http://onforb.es/OmS0C5,http://onforb.es/1IR71XC,1109653200000,False,False,,,False,0.0,0.0,0.0,0.0,0.0,0.0,0.0,0.0,0.0,0.0,0.0,0.0,0.0,0.0,0.0,0.0,0.0,0.0,0.0,,,,,,,,,
263,Billionaires,2005,3,din-hwa-chen,"Secretive and a committed Buddhist, Chen delisted his flagship company Nan Fung Textiles back in 1989. Despite the economic downturn of the late 1990s, Chen seems to have fared well. He bought 12% of fellow billionaire Ng Teng Fong&#8217; Sinoland and built up its portfolio of luxury properties, whose values have increased over 50% just in the past year.",321,billionaires,2000.0,,,"{'name': 'Din Hwa Chen', 'uri': 'din-hwa-chen'}",True,Din Hwa Chen,82.0,Hong Kong,,Hong Kong,,['Real Estate'],Hong Kong,1309540469974,1309540497098,,,,,0,faris/5/2005/4648,325,,,,,,,,,,,,http://onforb.es/1IR6Yer,http://onforb.es/Sk8iSp,http://onforb.es/1IR71XC,1109653200000,False,False,,,False,0.0,0.0,0.0,0.0,0.0,0.0,0.0,0.0,0.0,0.0,0.0,0.0,0.0,0.0,0.0,0.0,0.0,0.0,0.0,,,,,,,,,
264,Billionaires,2005,3,steve-cohen,"Wharton grad got start trading options at Gruntal &#38; Co. 1978; made $8,000 profit on first day. Founded hedge fund SAC Capital with $20 million 1992; now manages more than $4.5 billion in assets. Fund has average return of at least 40% annually over 12 years. Market mover: firm&#8217;s 40 portfolios believed to trade 20 million shares a day, accounting for as much as 3% of NYSE&#8217;s daily volume. Highly secretive investor commands highest performance fee in the business: 50% of the profits if certain benchmarks met. Avid art enthusiast (collects Andy Warhol), generous giver: with wife, Alex, serves on boards of Paul Tudor Jones&#8217; (see) Robin Hood Foundation, Michael J. Fox Foundation. Last year they committed $3 million to build clinic at Greenwich Hospital.",321,billionaires,2000.0,,,"{'name': 'Steven Cohen', 'uri': 'steve-cohen', 'squareImage': 'https://specials-images.forbesimg.com/imageserve/5a8d946e4bbe6f2652f61ca6/416x416.jpg?background=000000&cropX1=703&cropX2=3292&cropY1=80&cropY2=2667'}",True,Steven Cohen,49.0,United States,Connecticut,Greenwich,,['Investments'],United States,1309538495149,1309538594115,,,,,0,faris/5/2005/7426,326,,,,,,,,,,,,http://onforb.es/1IR6Yer,http://onforb.es/1BPareM,http://onforb.es/1IR71XC,1109653200000,False,False,http://specials-images.forbesimg.com/imageserve/5a8d946e4bbe6f2652f61ca6/280x425.jpg?fit=scale&background=000000,https://specials-images.forbesimg.com/imageserve/5a8d946e4bbe6f2652f61ca6/416x416.jpg?background=000000&cropX1=703&cropX2=3292&cropY1=80&cropY2=2667,False,0.0,0.0,0.0,0.0,0.0,0.0,0.0,0.0,0.0,0.0,0.0,0.0,0.0,0.0,0.0,0.0,0.0,0.0,0.0,,,,,,,,,
265,Billionaires,2005,3,john-de-mol,"Crowned a billionaire following the $5.3 billion sale of Endemol, the TV production company he founded with Dutch compatriot John de Mol, to telecom giant Telefonica in 2000. Though Endemol garnered fame for pioneering the reality TV genre with hits like Fear Factor, Van Den Ende&#8217;s true passion rests with musical theater. His Stage Holding produces shows like Mamma Mia! in more than a dozen theaters throughout Europe. Theater hasn&#8217;t proven as lucrative. Last fall Stage opened Dodger Stages, a five-theater complex, off Broadway in New York City. But the last minute pullout of a financial backer shelved a key act during the theater&#8217;s inaugural season, and Dodger Theatricals, winner of 46 Tony Awards, recently closed a three-and-a-half-year 42nd Street revival at a loss.",321,billionaires,2000.0,,,"{'name': 'John de Mol', 'uri': 'john-de-mol', 'squareImage': '//specials-images.forbesimg.com/imageserve/58a241814bbe6f0e5586b932/416x416.jpg?background=000000&cropX1=0&cropX2=744&cropY1=327&cropY2=1071'}",True,John de Mol,50.0,Netherlands,,Blaricum,,['Media'],Netherlands,1309542334501,1309542350076,,,,,0,faris/5/2005/7383,327,,,,,,,,,,,,http://onforb.es/1IR6Yer,http://onforb.es/1zwvLiA,http://onforb.es/1IR71XC,1109653200000,False,False,http://specials-images.forbesimg.com/imageserve/58a241814bbe6f0e5586b932/280x425.jpg?fit=scale&background=000000,//specials-images.forbesimg.com/imageserve/58a241814bbe6f0e5586b932/416x416.jpg?background=000000&cropX1=0&cropX2=744&cropY1=327&cropY2=1071,False,0.0,0.0,0.0,0.0,0.0,0.0,0.0,0.0,0.0,0.0,0.0,0.0,0.0,0.0,0.0,0.0,0.0,0.0,0.0,,,,,,,,,
