,name,year,month,uri,bio,rank,listUri,finalWorth,otherCompensation,countryRank,person,visible,personName,age,country,state,city,source,industries,countryOfCitizenship,timestamp,version,moneyRank,tvRadioRank,pressRank,webRank,socialRank,naturalId,position,imageExists,change,changePercent,selfMade,status,gender,birthDate,countryId,lastName,firstName,listDescription,shortUri,galleryShortUri,listShortUri,date,wealthList,familyList,thumbnail,squareImage,bioSuppress,factivaHits,webHits,tvRadio,recentEarnings,recentSales,recentBudget,gdp,budget,assets,totalCompensation,salary,bonus,stockOptions,population,audienceWeb,audiencePrint,audienceTv,employees,following,previousRank,csfDisplayFields,suppressOnProfiles,category,title,organization,employment,portraitImage,landscapeImage
121,Billionaires,2005,3,john-menard-jr,"Sole owner of home improvement chain with more than 170 stores, taking in $5 billion a year, constantly fighting Lowe&#8217;s and Home Depot for market share. Also counts IRS among principal foes: taxman claims CEO Menard&#8217;s profit-based bonuses are really nondeductible dividends. Menard fighting all the way. Press-shy hardware man also famous for micromanagement style, passion for auto racing.",144,billionaires,3800.0,,,"{'name': 'John Menard', 'uri': 'john-menard-jr', 'imageExists': True, 'squareImage': '//specials-images.forbesimg.com/imageserve/5f0f870a933def00067666de/416x416.jpg?background=000000&cropX1=223&cropX2=1909&cropY1=133&cropY2=1820'}",True,John Menard,65.0,United States,Wisconsin,Eau Claire,,['Retail'],United States,1309538696992,1309538715364,,,,,0,faris/5/2005/5376,145,True,,,,,,,,,,,http://onforb.es/1IR6Yer,http://onforb.es/1zwsTlD,http://onforb.es/1IR71XC,1109653200000,False,False,http://specials-images.forbesimg.com/imageserve/5f0f870a933def00067666de/280x425.jpg?fit=scale&background=000000,//specials-images.forbesimg.com/imageserve/5f0f870a933def00067666de/416x416.jpg?background=000000&cropX1=223&cropX2=1909&cropY1=133&cropY2=1820,False,0.0,0.0,0.0,0.0,0.0,0.0,0.0,0.0,0.0,0.0,0.0,0.0,0.0,0.0,0.0,0.0,0.0,0.0,0.0,,,,,,,,,
122,Billionaires,2005,3,thomas-schmidheiny,"Fourth generation of a Swiss-German industrial fortune. Holds 23.6% stake in cementmaker Holcim and has a seat on the board. Holcim is aggressively expanding, adding to its holdings in Mexico, the U.K. and India. Also manages his personal wine holdings, including the Cuvaison and Chapel Hill labels and the revamped Weingut Schmidheiny, a vineyard in Balgach, Switzerland, where he was born.",144,billionaires,3800.0,,,"{'name': 'Thomas Schmidheiny', 'uri': 'thomas-schmidheiny', 'squareImage': '//specials-images.forbesimg.com/imageserve/5c723437a7ea431000435227/416x416.jpg?background=000000&cropX1=1427&cropX2=2405&cropY1=14&cropY2=991'}",True,Thomas Schmidheiny,59.0,Switzerland,,Balgach,,['Construction &#38; Engineering'],Switzerland,1309543152699,1309543181362,,,,,0,faris/5/2005/4625,146,,,,,,,,,,,,http://onforb.es/1IR6Yer,http://onforb.es/1zwtfZJ,http://onforb.es/1IR71XC,1109653200000,False,False,http://specials-images.forbesimg.com/imageserve/5c723437a7ea431000435227/280x425.jpg?fit=scale&background=000000,//specials-images.forbesimg.com/imageserve/5c723437a7ea431000435227/416x416.jpg?background=000000&cropX1=1427&cropX2=2405&cropY1=14&cropY2=991,False,0.0,0.0,0.0,0.0,0.0,0.0,0.0,0.0,0.0,0.0,0.0,0.0,0.0,0.0,0.0,0.0,0.0,0.0,0.0,,,,,,,,,
123,Billionaires,2005,3,andreas-struengmann,"With twin brother Thomas, founded generic drug maker Hexal AG in 1986. Together they built it into Germany&#8217;s second-largest generic drug producer, with $1.6 billion sales last year. In February the twins sold Hexal and their 67.7% of U.S. Eon Labs to Novartis for $7.5 billion. No plans yet to retire: accepted an executive post with Sandoz, a generic division of Novartis, and will sit on Sandoz&#8217;s executive committee.",144,billionaires,3800.0,,,"{'name': 'Andreas Strungmann', 'uri': 'andreas-struengmann', 'imageExists': False, 'squareImage': '//specials-images.forbesimg.com/imageserve/6a78176d9c8ceafa3994533f92281f82/416x416.jpg?background=000000&cropX1=61&cropX2=553&cropY1=4&cropY2=496'}",True,Andreas Strungmann,55.0,Germany,,Tegernsee,,['Pharmaceuticals'],Germany,1309540688759,1309540706555,,,,,0,faris/5/2005/7712,147,False,,,,,,,,,,,http://onforb.es/1IR6Yer,http://onforb.es/1BOTZvC,http://onforb.es/1IR71XC,1109653200000,False,False,http://specials-images.forbesimg.com/imageserve/6a78176d9c8ceafa3994533f92281f82/280x425.jpg?fit=scale&background=000000,//specials-images.forbesimg.com/imageserve/6a78176d9c8ceafa3994533f92281f82/416x416.jpg?background=000000&cropX1=61&cropX2=553&cropY1=4&cropY2=496,False,0.0,0.0,0.0,0.0,0.0,0.0,0.0,0.0,0.0,0.0,0.0,0.0,0.0,0.0,0.0,0.0,0.0,0.0,0.0,,,,,,,,,
124,Billionaires,2005,3,thomas-struengmann,"With twin brother Andreas, founded generic drug maker Hexal AG in 1986. Together they built it into Germany&#8217;s second-largest generic drug producer, with $1.6 billion sales last year. In February the twins sold Hexal and their 67.7% of U.S. Eon Labs to Novartis for $7.5 billion. No plans yet to retire: like his brother, has accepted an executive post with Sandoz, a generic division of Novartis, and will sit on Sandoz&#8217;s executive committee.",144,billionaires,3800.0,,,"{'name': 'Thomas Strungmann', 'uri': 'thomas-struengmann', 'imageExists': False, 'squareImage': '//specials-images.forbesimg.com/imageserve/5a7e557831358e4955ad137a/416x416.jpg?background=000000&cropX1=0&cropX2=2573&cropY1=5&cropY2=2580'}",True,Thomas Strungmann,55.0,Germany,,Tegernsee,,['Pharmaceuticals'],Germany,1309541661719,1309541682719,,,,,0,faris/5/2005/7710,148,False,,,,,,,,,,,http://onforb.es/1IR6Yer,http://onforb.es/1BOUbel,http://onforb.es/1IR71XC,1109653200000,False,False,http://specials-images.forbesimg.com/imageserve/5a7e557831358e4955ad137a/280x425.jpg?fit=scale&background=000000,//specials-images.forbesimg.com/imageserve/5a7e557831358e4955ad137a/416x416.jpg?background=000000&cropX1=0&cropX2=2573&cropY1=5&cropY2=2580,False,0.0,0.0,0.0,0.0,0.0,0.0,0.0,0.0,0.0,0.0,0.0,0.0,0.0,0.0,0.0,0.0,0.0,0.0,0.0,,,,,,,,,
125,Billionaires,2005,3,kumar-birla,"Runs $7.5 billion (sales) commodities conglomerate Aditya Birla Group, India&#8217;s largest producer of copper and aluminium. Group derives 30% of its revenues overseas&#8212;copper mining in Australia, pulp mill in Canada, and carbon black factory in China. Plans to invest $4.6 billion over next four years in new infrastructure. Was conferred honorary doctorate by the Banaras Hindu University. Works out regularly and spends Sundays with wife and two children.",149,billionaires,3700.0,,,"{'name': 'Kumar Birla', 'uri': 'kumar-birla', 'squareImage': 'https://specials-images.forbesimg.com/imageserve/6345b30607bca24e9e6bc22e/416x416.jpg?background=000000&cropX1=1028&cropX2=2471&cropY1=348&cropY2=1792'}",True,Kumar Birla,37.0,India,,Mumbai,,,India,1309539438431,1309539462925,,,,,0,faris/5/2005/4537,149,,,,,,,,,,,,http://onforb.es/1IR6Yer,http://onforb.es/1zwsNuq,http://onforb.es/1IR71XC,1109653200000,False,False,http://specials-images.forbesimg.com/imageserve/6345b30607bca24e9e6bc22e/280x425.jpg?fit=scale&background=000000,https://specials-images.forbesimg.com/imageserve/6345b30607bca24e9e6bc22e/416x416.jpg?background=000000&cropX1=1028&cropX2=2471&cropY1=348&cropY2=1792,False,0.0,0.0,0.0,0.0,0.0,0.0,0.0,0.0,0.0,0.0,0.0,0.0,0.0,0.0,0.0,0.0,0.0,0.0,0.0,,,,,,,,,
126,Billionaires,2005,3,jeronimo-arango,"College dropout who earned billions by charming Sam Walton into expanding south of the border. His Cifra retail chain partnered with Wal-Mart in the early Nineties and was later bought out and renamed Wal-Mex. (Walmart now holds a 64% stake in Wal-Mex.) Spanish-born Arango, who briefly sat on the Wal-Mart board in the late Nineties, is no longer active in either company.",151,billionaires,3600.0,,,"{'name': 'Jeronimo Arango & family', 'uri': 'jeronimo-arango'}",True,Jeronimo Arango & family,79.0,Mexico,,,,['Retail'],Mexico,1309540735957,1309540762085,,,,,0,faris/5/2005/4289,151,,,,,,,,,,,,http://onforb.es/1IR6Yer,http://onforb.es/1BOTSjP,http://onforb.es/1IR71XC,1109653200000,False,False,,,False,0.0,0.0,0.0,0.0,0.0,0.0,0.0,0.0,0.0,0.0,0.0,0.0,0.0,0.0,0.0,0.0,0.0,0.0,0.0,,,,,,,,,
127,Billionaires,2005,3,bernard-ecclestone,"Owns 25% of Formula One. The banks that own the other 75% took Bernie to court last year to wrest more voting control away from him, but eventually admitted that Ecclestone knows how to run the company better than anyone. Ferrari has agreed to stay with Formula One until 2012, but the pressure of a renegade racing league being set up by restless manufacturers has not waned.",151,billionaires,3600.0,,,"{'name': 'Bernard Ecclestone & family', 'uri': 'bernard-ecclestone', 'squareImage': '//specials-images.forbesimg.com/imageserve/5e77ec33c7b02d000666e172/416x416.jpg?background=000000&cropX1=959&cropX2=4277&cropY1=0&cropY2=3316'}",True,Bernard Ecclestone & family,74.0,United Kingdom,,London,,,United Kingdom,1309542427139,1309542457438,,,,,0,faris/5/2005/4870,152,,,,,,,,,,,,http://onforb.es/1IR6Yer,http://onforb.es/1BOTPo6,http://onforb.es/1IR71XC,1109653200000,False,False,http://specials-images.forbesimg.com/imageserve/5e77ec33c7b02d000666e172/280x425.jpg?fit=scale&background=000000,//specials-images.forbesimg.com/imageserve/5e77ec33c7b02d000666e172/416x416.jpg?background=000000&cropX1=959&cropX2=4277&cropY1=0&cropY2=3316,False,0.0,0.0,0.0,0.0,0.0,0.0,0.0,0.0,0.0,0.0,0.0,0.0,0.0,0.0,0.0,0.0,0.0,0.0,0.0,,,,,,,,,
128,Billionaires,2005,3,frank-lowy,"The former deli-owner turned shopping mall Midas oversees a $40 billion (assets under management) portfolio of 126 centers on three continents. In July restructured to better position for growth; the three Westfield entities&#8212;Westfield Holdings, Westfield Trust and Westfield America Trust&#8212;merged to form Westfield Group, an internally-managed real estate group that is 11%-owned by Lowy &#38; family. In December 2003 he extricated himself from the nettlesome insurance and redevelopment battles surrounding the World Trade Center by selling his 99-year lease on the WTC&#8217;s subterranean shopping plaza to the Port Authority of New York &#38; New Jersey for $140 million. (His Westfield Holdings lost an employee at the World Trade Center on Sept. 11.) At the behest of the Aussie government is helping to revive the country&#39s languishing soccer league.",151,billionaires,3600.0,,,"{'name': 'Frank Lowy & family', 'uri': 'frank-lowy', 'squareImage': '//specials-images.forbesimg.com/imageserve/5e73f5382a573300068fc875/416x416.jpg?background=000000&cropX1=0&cropX2=3271&cropY1=6&cropY2=3280'}",True,Frank Lowy & family,74.0,Australia,,Sydney,,['Real Estate'],Australia,1309540689305,1309540718646,,,,,0,faris/5/2005/4915,154,,,,,,,,,,,,http://onforb.es/1IR6Yer,http://onforb.es/1zwtm7A,http://onforb.es/1IR71XC,1109653200000,False,False,http://specials-images.forbesimg.com/imageserve/5e73f5382a573300068fc875/280x425.jpg?fit=scale&background=000000,//specials-images.forbesimg.com/imageserve/5e73f5382a573300068fc875/416x416.jpg?background=000000&cropX1=0&cropX2=3271&cropY1=6&cropY2=3280,False,0.0,0.0,0.0,0.0,0.0,0.0,0.0,0.0,0.0,0.0,0.0,0.0,0.0,0.0,0.0,0.0,0.0,0.0,0.0,,,,,,,,,
129,Billionaires,2005,3,viktor-rashnikov,"Director and owner of Magnitogorsk Iron &#38; Steel Works, started there in 1967 and worked his way up. In 1998 fended off takeover attempts from associates of fellow steel magnate Iskander Makhmudov. Unlike the directors of other steel mills, Rashnikov has refrained from buying coalfields or foreign factories. Instead he accumulated cash and used it to buy out the government&#8217;s 23.8% stake in December 2004. Also managed to persuade the shareholders of Mechel steel group (run by fellow billionaires Igor Zyuzin and Vladimir Iorikh) to sell him their 15.4% stake in &#8220;Magnitka,&#8221; likely making him the controlling stakeholder.",151,billionaires,3600.0,,,"{'name': 'Viktor Rashnikov', 'uri': 'viktor-rashnikov', 'squareImage': '//specials-images.forbesimg.com/imageserve/5e77906c10380d0006fbc0ec/416x416.jpg?background=000000&cropX1=534&cropX2=1689&cropY1=53&cropY2=1208'}",True,Viktor Rashnikov,56.0,Russia,,Magnitogorsk,,,Russia,1309538277912,1309538305148,,,,,0,faris/5/2005/7635,155,,,,,,,,,,,,http://onforb.es/1IR6Yer,http://onforb.es/1BOTZfo,http://onforb.es/1IR71XC,1109653200000,False,False,http://specials-images.forbesimg.com/imageserve/5e77906c10380d0006fbc0ec/280x425.jpg?fit=scale&background=000000,//specials-images.forbesimg.com/imageserve/5e77906c10380d0006fbc0ec/416x416.jpg?background=000000&cropX1=534&cropX2=1689&cropY1=53&cropY2=1208,False,0.0,0.0,0.0,0.0,0.0,0.0,0.0,0.0,0.0,0.0,0.0,0.0,0.0,0.0,0.0,0.0,0.0,0.0,0.0,,,,,,,,,
130,Billionaires,2005,3,willi-isolde-liebherr,"Brother, Willi, and sister, Isolde, have run the diversified family business since their father died in 1993. Liebherr&#8217;s core construction crane unit continues to expand globally with forays into Eastern Europe and China this year. Growing business supplying large antifriction bearings and drive systems to wind power companies.",156,billionaires,3500.0,0.0,4.0,"{'name': 'Willi & Isolde Liebherr & family', 'uri': 'willi-isolde-liebherr', 'imageExists': True, 'squareImage': '//specials-images.forbesimg.com/imageserve/5a812de74bbe6f2652f5465b/416x416.jpg?background=000000&cropX1=916&cropX2=3658&cropY1=223&cropY2=2964'}",True,Willi & Isolde Liebherr & family,,Switzerland,,Bulle,,['Construction & Engineering'],Switzerland,1491251367383,7,0.0,,0.0,,0,faris/5/2005/4464,157,True,900.0,34.61538461538461,False,U,,,202.0,Liebherr,Willi &#38; Isolde,The World's Billionaires,http://onforb.es/1IR6Yer,,http://onforb.es/1IR71XC,1110430800000,False,False,http://specials-images.forbesimg.com/imageserve/5a812de74bbe6f2652f5465b/280x425.jpg?fit=scale&background=000000,//specials-images.forbesimg.com/imageserve/5a812de74bbe6f2652f5465b/416x416.jpg?background=000000&cropX1=916&cropX2=3658&cropY1=223&cropY2=2964,False,,,,,,,,,,,,,,,,,,,,198.0,"['rank', 'finalWorth', 'personName', 'bios', 'bio']",False,Construction & Engineering,,,,,
131,Billionaires,2005,3,julio-mario-santo-domingo,"Jet-setting Colombian billionaire is shopping for a buyer for his Bavaria brewery, Latin America&#8217;s second-largest. Also controls interests in media, oil and staffing outfits. Last year sold off Avianca Airlines, a perennial moneyloser. (In 1989 a terrorist reportedly blew up one of the airline&#8217;s flights after buying a ticket under Santo Domingo&#8217;s name.) Keeps homes in New York, Paris and Baru, his private island. Once served as Colombia&#8217;s ambassador to China.",156,billionaires,3500.0,0.0,1.0,"{'name': 'Julio Mario Santo Domingo', 'uri': 'julio-mario-santo-domingo', 'imageExists': True}",True,Julio Mario Santo Domingo,81.0,,,,,['Food and Beverage'],Colombia,1337116974203,1337117010619,0.0,0.0,0.0,0.0,0,faris/5/2005/4303,159,True,2100.0,150.0,False,U,M,-1458327600000.0,144.0,Santo Domingo,Julio Mario,The World's Billionaires,http://onforb.es/1IR6Yer,http://onforb.es/SkaRDY,http://onforb.es/1IR71XC,1109653200000,False,False,,,False,,,,,,,,,,,,,,,,,,,,,,,,,,,,
132,Billionaires,2005,3,david-barclay,"Reclusive twins no more, thanks to their bid for some of the media assets of Conrad Black&#8217;s troubled Hollinger International. Despite a long, drawn out trial, at which Frederick testified, brothers successfully acquired the Telegraph Group for $1.2 billion. In past three years have also acquired U.K. retailer Littlewoods and mail-order operations of the GUS group (a major shareholder of Burberry). They manage these businesses along with their extensive real estate portfolio from the island tax haven of Jersey.",160,billionaires,3400.0,,,"{'name': 'David &#38; Frederick Barclay', 'uri': 'david-barclay', 'imageExists': False, 'squareImage': 'https://specials-images.forbesimg.com/imageserve/605375c9a56d2a3eb3d1b586/416x416.jpg?background=000000&cropX1=0&cropX2=836&cropY1=0&cropY2=836'}",True,David &#38; Frederick Barclay,0.0,United Kingdom,,Island of Brecquou,,['Retail'],United Kingdom,1309540389737,1309540412704,,,,,0,faris/5/2005/7422,160,False,,,,,,,,,,,http://onforb.es/1IR6Yer,http://onforb.es/1zwtlQZ,http://onforb.es/1IR71XC,1109653200000,False,False,http://specials-images.forbesimg.com/imageserve/605375c9a56d2a3eb3d1b586/280x425.jpg?fit=scale&background=000000,https://specials-images.forbesimg.com/imageserve/605375c9a56d2a3eb3d1b586/416x416.jpg?background=000000&cropX1=0&cropX2=836&cropY1=0&cropY2=836,False,0.0,0.0,0.0,0.0,0.0,0.0,0.0,0.0,0.0,0.0,0.0,0.0,0.0,0.0,0.0,0.0,0.0,0.0,0.0,,,,,,,,,
133,Billionaires,2005,3,otto-beisheim,"Founded Metro Cash &#38; Carry in 1964, which eventually developed into Metro AG, now the world&#8217;s fifth-largest retailer. Still owns almost 19% of the group. Now retired, runs an Internet and technology company, Beisheim Holding Schweiz AG, and has built a 172,000-square-foot luxury development complete with hotels, apartments, office space, restaurants and shops near the Potsdamer Platz in central Berlin. The complex is likely to become embroiled in war restitution claim as a Jewish family has alleged that the land on which it stands was illegally sold to Beisheim. An avid sports fan (golf, tennis), has three foundations that fund athletic programs.",160,billionaires,3400.0,,,"{'name': 'Otto Beisheim', 'uri': 'otto-beisheim'}",True,Otto Beisheim,81.0,Switzerland,,Zoug,,['Retail'],Germany,1309538874603,1309538902538,,,,,0,faris/5/2005/4715,161,,,,,,,,,,,,http://onforb.es/1IR6Yer,http://onforb.es/Skcu4x,http://onforb.es/1IR71XC,1109653200000,False,False,,,False,0.0,0.0,0.0,0.0,0.0,0.0,0.0,0.0,0.0,0.0,0.0,0.0,0.0,0.0,0.0,0.0,0.0,0.0,0.0,,,,,,,,,
134,Billionaires,2005,3,john-fredriksen,"Son of a Norwegian welder turned a ship-brokering job as a teenager into control of the world&#8217;s largest fleet of oil tankers, through flagship Frontline Ltd. Benefiting from surging demand from China and India. Made big investment in liquefied natural gas tankers, betting that LNG would become the next crude oil; wager has yet to pay off. In the meantime he is awash in cash from spinoffs of Frontline subsidiaries and investments in overseas shipping companies like General Maritime. Collects classic Norwegian art. Reportedly turned down an offer of $190 million from fellow billionaire Roman Abramovich for his London home last year.",160,billionaires,3400.0,,,"{'name': 'John Fredriksen', 'uri': 'john-fredriksen', 'squareImage': '//specials-images.forbesimg.com/imageserve/5e7587f4d8e1ae0007b7161f/416x416.jpg?background=000000&cropX1=169&cropX2=817&cropY1=7&cropY2=655'}",True,John Fredriksen,60.0,Norway,,Oslo,,['Shipping'],Norway,1309539959134,1309539978919,,,,,0,faris/5/2005/4390,162,,,,,,,,,,,,http://onforb.es/1IR6Yer,http://onforb.es/1BOTr9d,http://onforb.es/1IR71XC,1109653200000,False,False,http://specials-images.forbesimg.com/imageserve/5e7587f4d8e1ae0007b7161f/280x425.jpg?fit=scale&background=000000,//specials-images.forbesimg.com/imageserve/5e7587f4d8e1ae0007b7161f/416x416.jpg?background=000000&cropX1=169&cropX2=817&cropY1=7&cropY2=655,False,0.0,0.0,0.0,0.0,0.0,0.0,0.0,0.0,0.0,0.0,0.0,0.0,0.0,0.0,0.0,0.0,0.0,0.0,0.0,,,,,,,,,
135,Billionaires,2005,3,robert-bass,"Third son of Texas oilman Perry Bass (see). Graduated from Yale, Stanford Business School. Father handed family business to eldest son, Sid; Robert, feeling overshadowed, broke out on his own 1983; moved one floor down in Bass-financed Fort Worth office tower. Arguably the better investor: diversified holdings included Wometco, Continental Broadcasting, Lone Star Technologies, San Juan Basin Royalty Trust. Sold Plaza Hotel to Donald Trump. His Oak Hill Capital Partners specializes in leveraged buyouts. Recent deal: buying Duane Reade drugstore for $700 million.",164,billionaires,3300.0,,,"{'name': 'Robert Bass', 'uri': 'robert-bass', 'squareImage': '//specials-images.forbesimg.com/imageserve/eb763e0ce54b28d44f850ffb6cfba5f2/416x416.jpg?background=000000&cropX1=0&cropX2=672&cropY1=3&cropY2=675'}",True,Robert Bass,57.0,United States,Texas,Fort Worth,,['Oil'],United States,1309540196385,1309540267338,,,,,0,faris/5/2005/5137,164,,,,,,,,,,,,http://onforb.es/1IR6Yer,http://onforb.es/1zwvdJn,http://onforb.es/1IR71XC,1109653200000,False,False,http://specials-images.forbesimg.com/imageserve/eb763e0ce54b28d44f850ffb6cfba5f2/280x425.jpg?fit=scale&background=000000,//specials-images.forbesimg.com/imageserve/eb763e0ce54b28d44f850ffb6cfba5f2/416x416.jpg?background=000000&cropX1=0&cropX2=672&cropY1=3&cropY2=675,False,0.0,0.0,0.0,0.0,0.0,0.0,0.0,0.0,0.0,0.0,0.0,0.0,0.0,0.0,0.0,0.0,0.0,0.0,0.0,,,,,,,,,
136,Billionaires,2005,3,paul-desmarais,"Bought his father&#8217;s one-route Ontario bus company for a dollar in 1951; eventually built into Power Corp., a $13 billion (sales) financial services and communications giant. Power Corp. consortium bought an indirect 25% stake in media giant Bertelsmann in early 2001. Also owns Investors Group, Canada&#8217;s largest mutual fund group, and has holdings in specialty mineral companies and waste services. The stock, which split in 2004, is up 25% in the past year. While sons Andre and Paul Jr. run the company, Paul Sr. collects Canadian art and hunts birds at his private estate in Quebec.",164,billionaires,3300.0,,,"{'name': 'Paul Desmarais', 'uri': 'paul-desmarais'}",True,Paul Desmarais,78.0,Canada,,Montreal,,,Canada,1309538921556,1309538950698,,,,,0,faris/5/2005/4956,165,,,,,,,,,,,,http://onforb.es/1IR6Yer,http://onforb.es/Skcr8P,http://onforb.es/1IR71XC,1109653200000,False,False,,,False,0.0,0.0,0.0,0.0,0.0,0.0,0.0,0.0,0.0,0.0,0.0,0.0,0.0,0.0,0.0,0.0,0.0,0.0,0.0,,,,,,,,,
137,Billionaires,2005,3,charles-b-johnson,"Father, Rupert Sr., founded early mutual fund shop Franklin Distributors 1947. Half-brothers took over 1969, expanded Franklin Resources by adding Templeton Funds 1992, Fiduciary Trust 2001. Also bought Heine Securities from value investor Michael Price (see) for $610 million in 1996. Today firm manages more than $350 billion. FKR named after Ben Franklin for his common sense, frugality. Yale grad and former Army lieutenant serves as chairman; son Charles&#8217; son, Gregory, assists as co-CEO.",164,billionaires,3300.0,,,"{'name': 'Charles Johnson', 'uri': 'charles-b-johnson', 'imageExists': False, 'squareImage': '//specials-images.forbesimg.com/imageserve/5d8a9df322254b0008e1617b/416x416.jpg?background=000000&cropX1=227&cropX2=1037&cropY1=290&cropY2=1100'}",True,Charles Johnson,72.0,United States,California,San Mateo,,['Finance'],United States,1309538752845,1309538794187,,,,,0,faris/5/2005/5325,166,False,,,,,,,,,,,http://onforb.es/1IR6Yer,http://onforb.es/1BOTHoy,http://onforb.es/1IR71XC,1109653200000,False,False,http://specials-images.forbesimg.com/imageserve/5d8a9df322254b0008e1617b/280x425.jpg?fit=scale&background=000000,//specials-images.forbesimg.com/imageserve/5d8a9df322254b0008e1617b/416x416.jpg?background=000000&cropX1=227&cropX2=1037&cropY1=290&cropY2=1100,False,0.0,0.0,0.0,0.0,0.0,0.0,0.0,0.0,0.0,0.0,0.0,0.0,0.0,0.0,0.0,0.0,0.0,0.0,0.0,,,,,,,,,
138,Billionaires,2005,3,sunil-mittal,"Self-made telecom entrepreneur. Runs India&#8217;s largest GSM-based cellular service provider, Bharti Tele-Ventures, whose stock is up 24% since January. Added 4 million subscribers in the past year, taking total to more than 10 million. Started venture to export fruits and vegetables with the Rothschild family. Spending $4.5 million to provide mobile services in tsunami-hit Andaman &#38; Nicobar islands.",164,billionaires,3300.0,,,"{'name': 'Sunil Mittal & family', 'uri': 'sunil-mittal', 'squareImage': 'https://specials-images.forbesimg.com/imageserve/61572f6aff2e22d56fabfa8a/416x416.jpg?background=000000&cropX1=1067&cropX2=3993&cropY1=0&cropY2=2928'}",True,Sunil Mittal & family,47.0,India,,Delhi,,,India,1309539214640,1309539237537,,,,,0,faris/5/2005/7474,167,,,,,,,,,,,,http://onforb.es/1IR6Yer,http://onforb.es/1zwsMGV,http://onforb.es/1IR71XC,1109653200000,False,False,http://specials-images.forbesimg.com/imageserve/61572f6aff2e22d56fabfa8a/280x425.jpg?fit=scale&background=000000,https://specials-images.forbesimg.com/imageserve/61572f6aff2e22d56fabfa8a/416x416.jpg?background=000000&cropX1=1067&cropX2=3993&cropY1=0&cropY2=2928,False,0.0,0.0,0.0,0.0,0.0,0.0,0.0,0.0,0.0,0.0,0.0,0.0,0.0,0.0,0.0,0.0,0.0,0.0,0.0,,,,,,,,,
139,Billionaires,2005,3,robert-rowling,"Corporate lawyer joined dad&#8217;s Tana Oil &#38; Gas in 1980; sold production units to Texaco in 1989, exploration division to Unocal. Bought luxury hospitality chain Omni Hotels 1996; now 40 hotels throughout North America. New Tana incarnation now producing gas in the Gulf. Branching out: last year bought legendary Gold&#8217;s Gym for $158 million and grabbed a stake in fast-growing Mexican dollar-store chain Waldo&#8217;s.",164,billionaires,3300.0,,,"{'name': 'Robert Rowling', 'uri': 'robert-rowling', 'squareImage': '//specials-images.forbesimg.com/imageserve/59d6500131358e542c035c5d/416x416.jpg?background=000000&cropX1=64&cropX2=496&cropY1=48&cropY2=480'}",True,Robert Rowling,51.0,United States,Texas,Dallas,,,United States,1309540197888,1309540271580,,,,,0,faris/5/2005/6701,168,,,,,,,,,,,,http://onforb.es/1IR6Yer,http://onforb.es/1zwtfZI,http://onforb.es/1IR71XC,1109653200000,False,False,http://specials-images.forbesimg.com/imageserve/59d6500131358e542c035c5d/280x425.jpg?fit=scale&background=000000,//specials-images.forbesimg.com/imageserve/59d6500131358e542c035c5d/416x416.jpg?background=000000&cropX1=64&cropX2=496&cropY1=48&cropY2=480,False,0.0,0.0,0.0,0.0,0.0,0.0,0.0,0.0,0.0,0.0,0.0,0.0,0.0,0.0,0.0,0.0,0.0,0.0,0.0,,,,,,,,,
